clean_tweet,sentimen
indonesia bensin etanol bisa beli spbu pertamina pertalite ron konfirmasi murni campur etanol spbu swasta shell bp akr vivo sedia stok sedang batas masalah pasok cek langsung,positive
campur etanol bisa bagus buat mesin injeksi naik oktan bikin bakar lebih efisien kurang emisi asal kadar rendah e kendara kompatibel buat karburator sering masalah nyerap air korosi mampet sistem,positive
menteri energi sumber daya mineral esdm bahlil lahadalia menep tuding sebut guna etanol campur bahan bakar minyak bbm dapat rusak mesin kendara baca lengkap sama,positive
motor tidak cocok bensin campur etanol utama model lama basis karburator etanol bisa rusak komponen karet sebab korosi tarik air picu masalah mesin motor injeksi modern biasa aman campur hingga e,positive
apa campur etanol harus uji jadi tidak rugi masyarakat bagi mesin kendara tidak cocok campur,negative
etanol campur rendah e relatif aman mesin kendara modern rancang kompatibel tingkat oktan bakar lebih bersih turun efisiensi bahan bakar hingga akibat densitas energi lebih rendah risiko korosi,positive
ekonom senior indef fadhil hasan bijak campur etanol bagi transisi energi jangan lupa tonton tuntas like subscribe comment share pelosok negeri lengkap kanal youtube balitbang partai golkar,positive
maaf response belum salah paham soal motor mogok massal isi pertalite banyak lapor jatim sejak akhir oktober duga campur etanol e air bikin mesin brebet busi karat pertamina bantah oplos etanol bilang sesuai standar amp,negative
nyata bahlil etanol tidak buruk bbm umum benar campur e sukses terap as brasil eropa kendara modern kurang emisi impor minyak indonesia rencana terap tahap hingga timbang,positive
viral motor rusak pertamina pasti pertalite blora aman campur air etanol,positive
bukan campur etanol baru terap,neutral
konfirmasi resmi pertamina tambah kadar etanol bbm rencana mandatori e etanol baru laku pertamina klaim tidak ganggu performa kendara keluh rupa lamongan surabaya duga campur,positive
kayak kamu maksud dimethyl carbonate dmc zat sering campur bensin etanol buat tingkat performa kurang emisi riset ilmiah campur minyak air etanol bisa jadi emulsi alternatif butuh emulsi meski stabil aman kalau uji lab,positive
etanol bensin indonesia biasa asal bioetanol produksi bahan baku lokal tebu singkong jagung perintah sedang dorong campur e etanol tahan energi kalau bensin lihat campur air minyak bisa jadi,negative
konsumen campur etanol e punya pro kontra untung kurang emisi tingkat oktan performa mesin lebih baik potensi harga bbm lebih stabil produksi lokal tebu kembang rugi efisiensi bbm turun butuh lebih banyak bahan,positive
etanol bisa serap air bikin filter amp injektor mampet bahkan korosif buat sistem bahan bakar lama aku energi hijau bikin mesin boros percuma mayoritas kendara indonesia siap pakai campur etanol tinggi,negative
jujur opo sing cekel bahlil level e wis ngrepotno seluruh lapis masyarakat mulai langka lpg tambang raja ampat tutup spbu swasta campur etanol bahan bakar cok moga ngisingmu mbeling nguyuhmu nyolar,negative
terus aku biasae ngisi pom gribig kene kok memang dlk instagram onok klarifikasi e lk bensin e campur etanol wooo gendenggg te lok kmhe ta kok bahan bakar e campur mbe etanol begini,negative
masalah benar sederhana order base fuel tau arti murni campur urus etanol baik tidak urus suwidak jaran,negative
kasih additive bensin octane booster injector cleaner campur tangki bbm ogut pakai lama isu campur etanol sih bodoh bisa coba pakai produk complete fuel sistem cleaner protect bbm etanol e safe,negative
masalah mesin kendara sini sekali bagus sana memang khusus nampung bahan bakar campur etanol etanol serap air alhasil mesin sini gampang karat akhir gampang rusak,positive
kalau pom mungkin oknum kalau banyak pom bisa jadi struktural qc awas bobrok kalau memang qualitas bbm jelek kan kemari batas campur etanol boleh seperti ckuuuuaaaakkkkks,negative
rekening investigasi pertamina kanggo nemokake akar masalah sing benar tidak campur etanol sing standar pertalite wis bioetanol wiwit bisa amarga distribusi simpan utawa kontaminasi ing spbu jadi yaiku tanggung jawab atur kualitas bbm sing aman kanggo,positive
rekening akhir akhir banyak keluh motor brebet mogok ing jatim sawise isi pertalite duga amarga kualitas bbm sing ganggu mungkin campur etanol utawa kontaminasi liyane pertamina investigasi uji lab sampel saran ganti pertamax cek bengkel,negative
bahlil sindir spbu swasta soal polemik etanol jangan paksa hendak banyak negara pakai campur e dapat update kabar baru bangbara cukup gabung lalu salur whatsapp klik gabung sini,positive
tanggal oktober selamat hari brebet nasional jadi suatu tanya bbm campur etanol misah campur tiga satu cinta dua pertamina tidak juru kunci solusi rakyat teriak kemarin kabur,positive
campur etanol e pertalite mulai tuju kurang impor bbm dorong produksi bioetanol lokal tebu tekan emisi karbon sesuai riset global as brasil sukses terap e ganggu mesin modern post kurang utama kandung,positive
sama campur etanol tidak sih,neutral
mungkin besar meme viral sindir bijak bahlil lahadalia soal campur etanol pertalite bikin banyak motor mogok air campur gambar bahlil china seperti edit salah identifikasi berita kini tunjuk sibuk,positive
mungkin beberapa tangki penyimpananya bocor jadi bikin tangki lembab bensin pertamina punya campur etanol sifat higroskopis serap air jadi kadar air tinggi bahan bakar buat kendara mbrebet,negative
bahlil lahadalia ungkap bijak bensin campur etanol penuh rencana kurang impor bbm,positive
aku ket sadar wong ramai perkara bensine dikei campur etanol jambu aku ket taun wing kerja green terus mana etanol e,neutral
masalah motor mbrebet surabaya banyak lapor isi pertalite duga sebab kualitas bbm masalah mungkin campur etanol kontaminasi pertamina sedang investigasi siap ganti rugi bukti saran coba ganti pertamax ganti busi filter,positive
bahlil tegas spbu swasta jangan paksa soal campur etanol bbm lewat news,neutral
baik coba tanya kait mungkin pakai etanol dampak ekosistem otomotif indonesia hingga update harga etanol industri campur bahan bakar jawab,positive
india amerika serikat pakai campur etanol bensin indonesia coba dong,neutral
teter esdm bahlil bahas blending bbm etanol bukan sekadar campur sabtu buzz,neutral
dasar lapor berita kini kompas detik oktober isu memang ramai jatim lamongan tuban bojonegoro ratus motor brebet mogok usai isi pertalite gejala tari berat busi mati duga bau bbm aneh mungkin campur etanol,negative
kalau arti etanol cuma cocok buat kendara desain pakai oktan atas bikin atur kecuali meski pertalite tetap fosil campur bioetanol kalau benar mau pihak demografi mayoritas,positive
tidak campur etanol kan,positive
betul khawatir soal kompatibilitas kendara campur bbm etanol memang sering muncul utama kendara lama mobil mobil indonesia kompatibel kandung etanol hingga persen loh bukan klaim kosong dasar,positive
bukan masalah etanol tidak perintah tidak sesuai janji swasta minta base fuel beri campur,negative
jadi masalah banyak kendara sini tidak kompatibel campur bbm etanol utama kendara lama kalau omong eropa amerika sih sana tidak banyak kenfaraan lama edar rata kendara sana kompatibel bahan bakar bbm etanol,positive
bob azam wakil presiden direktur toyota motor manufacturing indonesia campur etanol persen bbm tidak perlu debat bbm indonesia persentase etanol lebih tinggi kalau bensin kan tambang produksi,positive
negara agraris lebih lanjut bob azam tegas bijak campur etanol bukan bicara soal siap kendara soal dampak lingkung tahan energi nasional guna bahan bakar basis etanol dapat hasil tanam,positive
campur etanol tinggi serap uap air musim hujan jadi bawah tangki motor isi air makanya brebet,positive
thailand laju jauh transisi energi bukan biofuel kendara darat masuk bahan bakar pesawat hijau saf indonesia baru mulai dorong campur etanol bbm masih jebak debat dasar,negative
khawatir campur etanol bbm buat mesin cepat korosif benar lebih banyak asal opini besar besar isu kerap kipas kipas gelintir pihak picu takut publik olah semua kendara rusak,positive
motor kok brebet semua campur etanol,neutral
jangan lewat isu bbm etanol tengah ramai bicara padahal bahan bakar campur etanol guna kendara indonesia kenapa jadi polemik apa tantang fakta lapang temu jawab primetime news metro tv sama mars ega,neutral
pertamina campur etanol mbrebet padahal tahun harap campur etanole jadi,negative
pakar umsida etanol aman jadi campur bahan bakar kendara kadar persen,positive
menteri esdm bahlil lahadalia bilang perintah bakal terapin kalau bensin campur etanol e tahun pihak bakal kirim tim brasil buat ajar kembang bioetanol,neutral
pantek kali tengok atur bahan bakar sekarang beli petasol anjing bisa bobrok lama lama pakai campur etanol,positive
padahal ethanol digawe campur sial puluh tahun neng an bio pertalite bio premium bio solar busuk semua subsidi tas saiki ngumumno te kerja lucu kamu tuku bensin pertalite pertamax cekelen duliten kan nyes koyok sono alkohol e yoiku campur etanol,negative
tidak takut fakta ilmiah pertalite etanol campur fisik bukan reaksi kimia bikin unsur baru etanol bisa tarik air udara tidak langsung bentuk h o campur kalau mau simulasi sederhana coba cek jurnal kimia tes lab,negative
reaksi kimia pertalite hidrokarbon sih h etanol sih h campur fisik bukan reaksi langsung bakar mesin etanol sih h o cowok h o hidrokarbon sih h o cowok h o hasil h o bisa sebab korosi,negative
pertalite hidrokarbon etanol tidak hasil reaksi kimia bentuk unsur baru campur fisik bukan reaksi tidak unsur kimia baru h o langsung bentuk campur etanol justru tarik air udara bisa picu korosi,positive
pertalite campur hidrokarbon etanol sih h campur biofuel oktan lebih tinggi kurang emisi etanol higroskopis tarik air bisa picu korosi air tumpuk resmi pertamina bilang pertalite tidak campur etanol sumber pertamina oktober versi,positive
jelas jangan hitung sisa ilmu ekonomi terus jangan campur etanol pertalite bisa sebab mesin korosi campur kandung h o air sperma sedikit bisa buah telur,negative
direktur utama pertamina patra niaga mars ega legowaputra tegas campur etanol bahan bakar minyak bbm dapat kurang emisi karbon kurang gantung energi fosil,negative
siram pakai campur etanol,neutral
khawatir bisa paham mandatori e memang perlu siap matang tidak timbul beban baru capai campur indonesia butuh pasok etanol besar tara konsumsi bensin nasional produksi negeri siap impor etanol,positive
pt csi tegas produk kompatibel bbm campur etanol,negative
indonesia amp brasil resmi sepakat kembang bahan bakar etanol ramah lingkung mou ditandatangani istana merdeka presiden prabowo amp presiden lula silva campur e etanol mulai naik tahap e kurang impor bbm amp polusi naik,positive
rencana terap e bisa jadi langkah strategis tekan impor bensin emisi capai campur indonesia butuh pasok etanol besar tara konsumsi bensin nasional produksi domestik siap impor etanol justru bisa,positive
campur etanol berapa persen kakak,neutral
menteri energi sumber daya mineral esdm bahlil lahadalia tegas perintah wajib guna bahan bakar minyak bbm campur etanol besar persen bioetanol persen e mulai,positive
menteri energi sumber daya mineral esdm bahlil lahadalia tegas perintah wajib guna bahan bakar minyak bbm campur etanol besar bioetanol e mulai bijak sebut kata bahlil rupa langkah strategis,positive
mesin mesin lama rancang bahan bakar campur etanol akibat tari mesin asa lebih berat konsumsi bbm malah tingkat sistem bahan bakar bisa lebih cepat kotor karat,positive
terap bbm campur etanol persen bahlil kirim tim brasil,neutral
bioetanol gadang gadang jadi solusi energi hijau efektif menteri esdm bahlil lahadalia umum guna bensin campur bioetanol e wajib nasional mulai tahun,positive
menteri energi sumber daya mineral esdm bahlil lahadalia pasti terap mandatori campur etanol persen e bahan bakar minyak bbm mulai mandatori bangun bensin e e ujar bahlil,neutral
bukan soal campur etanol persen duga alas bp shell enggan beli bbm pertamina jawa pos,neutral
goblog cari tahu cela negara maju eroapa amp amerika etanol pakai campur bbm bagi green energi,negative
begini harga etanol bakal jadi campur bbm indonesia,neutral
ciri goreng etanol pertamax oplos bumbu pertalite campur gosong,neutral
rencana pertamina hadir bahan bakar minyak bbm campur etanol persen e tampak sambut positif jumlah produsen sepeda motor indonesia salah satu datang tvs motor indonesia baca lengkap,positive
rencana pertamina hadir bbm campur etanol persen e sambut positif jumlah produsen sepeda motor indonesia salah satu datang tvs motor indonesia baca lengkap,positive
full etanol bos tidak usah campur bagaimana sorgum potensial loh duren sama nangka amonia bisa kali buat campur elpiji,positive
campur bbm nilai tidak efisien risiko rusak,neutral
harga etanol murni campur bbm kira rp ribu liter perintah rencana guna e mulai mandiri energi,positive
harga etanol murni konsentrasi persen punya nilai jual rp ribu liter etanol campur bbm persen e tambah ongkos bensin sekira rp,positive
apa tidak pilih kalau ujung impor ethanol impor bahan baku produksi lokal kurang kenapa tidak fokus bikin bbm sendiri kilang up kan bagaimana dapat kalian,positive
begini harga etanol bakal jadi campur bbm indonesia,neutral
belum shall jual bensin tidak pakai etanol kok performa mesin sangat bagus pertamina guna campur etanol performa mesin jelek kepala masyarakat alas,negative
cie bbmnya murni campur etanol lapor rakyat lapor disertasi joki sih bodoh,negative
benar beberapa jenis bbm bensin indonesia pertamax green pertamina kandung etanol hingga aditif tingkat oktan kurang emisi baru baru campur etanol base fuel picu kontroversi spbu swasta,negative
rasa campur etanol bikin tambah boros motor motor mesin jadi asa tidak enak ironis,positive
perintah siap juta hektare lahan singkong campur bbm ramah lingkung,positive
american petroleum institute kejut tarik dukung rancang undang undang luas jual bahan bakar campur etanol lebih tinggi e as alas ubah kondisi simak lengkap,negative
upaya perintah tekan emisi kendara dapat angin segar lewat rencana terap bahan bakar campur etanol biofuel e mulai baca lengkap,positive
campur etanol bbm bisa turun kandung sulfur cek fakta,neutral
toyota pasti mobil produksi bisa pakai bensin campur etanol sejak bahkan beberapa model mampu guna campur hingga persen jalan rencana perintah terap bahan bakar e toyota pernah buat mesin bisa tenggak etanol,positive
upaya perintah tekan emisi kendara dapat angin segar lewat rencana terap bahan bakar campur etanol biofuel e mulai baca lengkap,positive
yaaakiiinnnn tidak pakai campur etanol maret kemarin pakai logo kerang,neutral
mandatori e bahlil paling lama bisa jalan menteri energi sumber daya mineral esdm bahlil lahadalia ungkap implementasi mandatori e campur etanol bensin dapat jadi tahun kata bahlil lepas hadir rapat,neutral
betul banget kata pak bahlil taat atur kamu jelas sepakat base fuel malah campur etanol cari negara sana kamu,negative
begitu dampak campur etanol,neutral
sumber detikoto,neutral
aman campur etanol,positive
pakar itb bilang campur etanol bisa turun sulfur bbm,neutral
simak rangkai reaksi kimia campur bensin etanol jadi eletrolit sifat korosif bagi besar jenis logam,positive
campur bensin etanol milik sifat beda bensin murni komponen bisa rusak karena,positive
pakar itb bilang campur etanol bisa turun sulfur bbm,neutral
perintah target terap bahan bakar campur etanol e bisa jalan menteri esdm bahlil lahadalia jelas bijak masih kaji perlu bangun pabrik etanol negeri serap bahan baku singkong,positive
campur etanol sis,neutral
menteri energi sumber daya mineral esdm tengah timbang laku bijak bahan bakar nabati campur etanol e mulai tahun,positive
kalau etanol buat kendara bolak balik bengkel guna kendara negara negara pakai etanol mungkin teriak teriak,neutral
bahlil sebut campur etanol bbm laku paling cepat,neutral
kendara modern indonesia produksi umum kompatibel campur etanol hingga e resiko karat signifikan esdm pabrikan toyota kendara lama motor bisa risiko korosi tangki mesin sifat higroskopis,positive
banyak baru tahu kalau bbm sekarang campur etanol sedikit,positive
bioetanol jadi campur bbm kan masih barang baru kontroversi muncul alas takut mesin karat performa turun muncul masalah baru keluh guna kendara padahal riset itb bilang dampak sebut mitos etanol aman,positive
memang sisi baik campur etanol sisi buruk tidak semua mesin cocok pakai bensin campur sifat etanol bisa serap air kelembaban udara etanol serap air air endap dasar tangki bikin karat,positive
brasil amerika uni eropa thailand filipina semua pakai bahan bakar campur etanol mesin tidak ledak ekonomi malah jalan indonesia sayang masih kurang edukasi padahal punya semua bahan baku tebu singkong limbah sawit semua,negative
akademisi itb itera soal etanol aman jadi bahan campur bbm,positive
kata aman teman,positive
bahlil lapor prabowo bbm campur etanol e biodiesel b siap cepat,positive
sama kasih campur etanol,neutral
belakang makin marak campur etanol bensin meski ramah lingkung kadar etanol lebih bisa bikin tangki bahan bakar kotor performa mesin turun loh,negative
bahlil makanya pertamina campur etanol buat kurang emisi,neutral
campur etanol persen e bensin mulai gencar perintah buat kurang impor minyak emisi dengar hijau aman,positive
benar sulfur retinol etanol campur skincare bukan bahan bakar,positive
bijak bbm e jadi langkah nyata tuju mandiri energi nasional campur etanol indonesia cepat transisi tuju energi bersih ramah lingkung lanjut,positive
bbm e hadir langkah cerdas tuju indonesia bebas emisi campur etanol bijak dorong energi lebih bersih efisien ramah lingkung,positive
bbm e jadi solusi hijau generasi datang campur etanol bahan bakar bantu tekan emisi karbon kuat komitmen indonesia tuju energi bersih lanjut,positive
shell guna etanol campur produk bahan bakar minyak bbm jadi amerika serikat kandung etanol produk gasoline shell shell regular unleaded bisa capai produk diesel,neutral
guru besar ub campur etanol hingga persen aman kendara,positive
mana bukti mesin kendara rusak campur etanol iq kamu memang berapa maa browww,neutral
motor tidak punya sistem lumas beda motor modern kandung etanol bbm bisa bikin lumas gagal mesin cepat aus,positive
terka bijak campur etanol bbm gasohol gasoline alcohol etanol bioethanol banyak guna campur bbm gasoline oxygenate perintah rencana terap madatori e etanol campur bensin next,positive
amerika uni eropa pakai etanol bahan campur bbm,neutral
pertamina dukung campur bbm etanol persen,neutral
belakang isu campur etanol bbm ramai banget bahas bilang solusi buat energi bersih ragu sama dampak ayo lik bareng slide ikut baca berita lengkap idn application,negative
rahasia kualitas bensin shell shell pernah tolak beli bbm pertamina kandung etanol sejak kapan temu rahasia campur bensin arsip majalah tempo catat shell kenal istimewa shell amp shell extra bensin formula,neutral
resin susah rata admin kalau tangki sering beberapa bagi malah gumpal epoxy kuat kok sama etanol admin campur epoxy kan thinner lebih keras etanol,positive
direktur utama pertamina simon aloysius mantiri nyata dukung penuh bijak perintah terap campur persen etanol e bahan bakar bensin mulai tahun depan langkah jalan upaya transisi energi bersih kurang emisi,positive
direktur utama pt pertamina persero simon aloysius mantiri nyata pertamina dukung bijak perintah kait terap campur etanol besar persen bahan bakar minyak bbm,positive
kuota impor baru kasih tahun depan kemarin nego soal campur etanol gagal makanya spbu swasta tidak jadi impor,negative
sedih banget jadi orang indonesia beli emas buat invest malah emas nyata campur logam beli bensin campur etanol butuh semua makin naik duit masih investasi saham turun kadang anjlok banget untung sedikit kadang ngestuck,negative
move on jangan suka melintir mbak masa depan generasi muda bangsa tidak stunting cerdas sehat campur etanol kurang impor bbm hemat devisa mendayagunakan tani industri etanol negeri,positive
pertamina ikut arah perintah soal campur etanol persen kandung bbm,neutral
aman bbm murni cenderung lebih aman daerah lembab etanol sifat higroskopis serap air risiko fase pisah korosi ganggu mesin simpan buruk campur e modern aditif aman kendara baru as,positive
mana mana bbm memang punya campur etanol blokir kamu kira indonesia masalag vivo kemarin bbm murni tampa campur pertamina jual vivo bbm campur sedan punya standar racik bbm sendiri,positive
motor aku kalau beri campur etanol apa apa tidak mogok info demo,negative
jelas pak youtubenya cing abdel sangat detail buat campur etanol bensin demand tinggi masih sangat tidak efisien bahan baku rebut sama butuh inti cost lebih mahal,positive
jujur lebih pikir sumber etanol darimana kalau butuh etanol campur bahkan masih tidak semua kota indonesia sumber etanol batas masih rebut sama butuh pasok gula haha,positive
pertamina ikut arah perintah soal campur etanol persen bbm,neutral
dukung arah perintah kata simon baca lengkap,positive
direktur utama pt pertamina simon aloysius mantiri nyata pertamina dukung bijak perintah kait terap campur etanol besar persen bahan bakar minyak bbm dukung arah perintah kata simon kompleks istana presiden,positive
campur etanol bbm lazim banyak negara kurang emisi gantung impor minyak as e jadi standar bensin konvensional sejak brasil terap e nasional eropa guna e e bagai negara,positive
etanol campur bbm e umum aman kendara modern keluar atas bisa kurang emisi dukung energi lokal resiko bisa serap air sebab korosi bikin boros bensin utama kendara tua kadar air tinggi,positive
grafik katadata tampil daftar negara guna bahan bakar campur etanol banyak dunia amerika serikat tempat posisi pertama konsumsi etanol tinggi susul brasil urut dua china kanada india ada jauh bawah ilustrasi,positive
teliti universitas brawijaya ungkap campur etanol bbm bukan baru uji sejak era bj habibie,neutral
campur etanol e e justru aman guna mesin memang rancang kompatibel video bagi akun ruditoaau sebut hasil teliti sae bukti e e tidak rusak mesin kompatibel,positive
isu soal guna bahan bakar campur etanol kerap timbul khawatir kalang guna kendara teliti baru society of automotive engineers sae tunjuk,negative
bahan bakar campur etanol e kini jadi tren global upaya tekan emisi jaga lingkung jumlah negara maju amerika serikat inggris jerman hingga brasil lebih adopsi bahkan alih campur etanol lebih tinggi,positive
ub nyata laku uji campur etanol bahan bakar minyak bbm guna mesin kendara jauh jauh hari,negative
tape campur air bisa jadi etanol lumayan buat campur bbm pertalite,positive
etanol import tambah cuan buat mafia perintah konoha,neutral
perintah rencana terap campur etanol persen bensin dukung tahan energi sekaligus kurang emisi karbon ikut lengkap etanol laman,positive
wakil presiden direktur tmmin sebut guna bbm campur etanol jadi umum bagai negara dukung teknologi kendara modern,positive
toyota indonesia nilai debat kait guna bahan bakar campur etanol e tidak perlu panjang pihak usaha lihat bijak langkah positif tuju terap energi lebih ramah lingkung tanah air,positive
umum menteri esdm tahun depan mulai pakai premium bensin campur persen etanol metanol program inti ujar menteri koordinator bidang pangan zulkifli hasan zulhas baca lengkap sama,positive
perlu riset lanjut campur etanol aman semua kendara,positive
mobil baru biasa aman pakai campur etanol pandu mobil tua tetap butuh,positive
distribusi bbm perlu reformasi jadi campur etanol bisa bantu baik sistem,neutral
bijak campur etanol konsisten masyarakat percaya,positive
bijak tuju guna bahan bakar campur persen etanol metanol bawa dampak luas ekonomi utama sektor tani,positive
perintah edukatif meski masyarakat paham manfaat resiko campur etanol,positive
perintah transparan meski masyarakat paham efek campur etanol mesin,neutral
efek campur etanol tidak selalu langsung lihat dampak tetap asa,neutral
efek campur etanol cermat mesin kendara tetap aman,positive
bijak campur etanol bisa bikin resah kalau tepat efek signifikan,positive
bijak campur etanol bisa bingung konsistensi bikin dampak positif buat bbm,positive
koordinasi semua pihak penting meski bijak campur etanol jalan lancar,positive
distribusi bbm transparan campur etanol beri efek optimal,neutral
not to mention potensi rusak mesin mobil cocok campur etanol pretty sure bisa buruk emisi bbm so is ethanol worth all the trouble,positive
tidak bukti tunjuk celaka sebab campur etanol bensin dasar berita kini e etanol indonesia lebih dampak efisiensi bahan bakar emisi bukan celaka lalu lintas sebab celaka,positive
perlu riset lanjut meski campur etanol aman buat semua kendara,positive
bijak campur etanol konsisten meski masyarakat percaya,positive
perintah transparan meski masyarakat paham efek campur etanol mesin,neutral
perintah edukatif meski masyarakat erti manfaat resiko campur etanol,positive
distribusi bbm berantak bikin campur etanol jadi langkah awal rapihin sistem,positive
efek campur etanol tidak selalu langsung asa dampak bakal lihat,neutral
bijak campur etanol bikin bingung kalau konsisten bisa positif buat efisiensi bbm,positive
mobil lama butuh perhati khusus kalau pakai campur etanol meski awet,positive
koordinasi semua pihak meski bijak campur etanol jalan lancar,positive
distribusi bbm transparan meski efek campur etanol optimal buat kendara,neutral
distribusi bbm kadang berantak jadi campur etanol bisa jadi awal rapihin sistem,negative
mobil lama butuh perhati kalau pakai campur etanol mobil baru lebih aman,positive
distribusi bbm berantak butuh reformasi jadi campur etanol bisa bantu,neutral
mobil baru aman pakai campur etanol perintah perlu pandu buat mobil tua,positive
ribut minta premium base campur beri pakai campur ethanol guna banyak negara maju pimpin toyota heran spbu swasta ribut kandung etanol,negative
