clean_tweet,sentimen
bensin etanol rusak mesin buah mercy tahan tahun inggris bensin india hancur hari ganti pompa bensin ganti injektor ganti semua bisa ganti nyata bensin campur etanol bunuh mesin belum jalan lancar lama tahun,positive
turun oktan etanol blending value jadi campur bbm campur bensin beroktan rendah misal ron proporsi tentu contoh etanol base gasoline rendah bisa hasil ron uji lab perlu,negative
menteri esdm target terap bahan bakar campur etanol persen e bisa mulai lebih cepat baca lengkap,positive
menteri esdm target terap bahan bakar campur etanol persen e bisa mulai lebih cepat baca lengkap,positive
kerja apa bu alhamdulillah laris kakak jual beli bayi sekarang proses produksi bayi kualitas premium campur etanol minat boleh nego tidak boleh nego popok,positive
toyota motor corp rencana tanam investasi nila rp triliun kembang ekosistem bioetanol indonesia langkah jalan bijak perintah terap mandatori bahan bakar campur etanol e proyek sebut,positive
bahlil jahanam bbm campur etanol kau legal emisi kau jegal laknat,positive
bijak mandatori e memang bisa jadi langkah hijau tuju transisi energi perlu siap matang capai campur indonesia butuh pasok etanol cukup besar tara konsumsi bensin nasional produksi lokal siap impor bisa,positive
biosolar mesin biodiesel kalau diesel bbm organik biosolar cuma masih campur b full bbm minyak sawit beda kakak sama biofuel kalau biofuel kandung etanol jauh arah e baru mesin balap kayak f,positive
campur etanol memang diujicoba,neutral
tolol murni campur etanol,positive
kenal etanol unggul bahan campur bbm,positive
nada suzuki mitsubishi pasti mobil bensin pasar bisa guna bioetanol campur hingga persen,neutral
pikul putar informasi ilmu special edition halo warga teknik kimia etanol bukan sekadar campur ubah cara mesin kerja,positive
pertamina pasar bbm bioetanol bukan pertalite bbm pertamina campur bioetanol persen,neutral
kata bbm ron karya anak bangsa bahan ramah lingkung banyak rakyat dukung jelas etanol murni kok dukung kemarin protes keras perintah campur etanol padahal realisasi tidak jelas banget orang indonesia bodoh,positive
bapak tidak paham inti masalah kendara indonesia dukung bahan bakar campur etanol,positive
sekretaris umum gabung industri kendara motor indonesia kukuh mara kata uji coba e campur etanol bensin laku japan automobile manufacturers association jumlah negara asia pasifik masuk indonesia laksana,negative
coba punya buku pandu h indak injeksi baca bbm campur etanol tinggi efek sebab cat tangki rusak sebab karat tank sebab kendara tidak baik gamabr buku pandu resmi h indak,negative
mungkin campur metanol etanol bensin dua sifat higroskopis sepeda motor pasar indonesia depan ganti platform chassis mesin sesuai bijak perintah tuju energi baru e e,positive
kayak isi kepala campur tahi sapi sama etanol deh kakak,negative
pertamina pakai campur etanol wah bodoh pertamina motor gue jadi rusak pakai bbm pertamina bobibos baham baku tanam etanol mantap karya anak bangsa bikin pertamina bangkrut pe pertamina cuma bisa ketawa lihat kelakuam masyarakat,positive
sini potensi karat mulai jadi tangki logam sentuh lapis air etanol perlahan korosi bila ikut sedot mesin campur bisa ganggu bakar bikin mesin sendat,negative
kadar air lebih batas larut e air etanol pisah bensin campur berat air etanol turun dasar tangki tempat pompa bahan bakar kerja,negative
bensin campur etanol e e arti kandung etanol sisa bensin etanol punya rumus kimia sih h bahan mudah bakar serap air udara higroskopis,neutral
kandung lebih homogen air murni lebih korosif inti etanol ubah air sekadar endap pisah mudah deteksi jadi campur lebih mudah bentuk lebih bahaya terhisap pompa sila kalau bisa bantah,positive
etanol lepas bensin bentuk campur etanol air kemudian endap dasar tangki phase separation campur etanol air isap pompa jauh lebih rusak potensi sebab mogok massal,positive
masalah bisa jadi cenderung lokal perlu akumulasi air besar terhisap pompa analisa amp fakta campur etanol e higroskopisitas etanol e fungsi jembatan bensin non polar air polar,positive
etanol buruk masalah beberapa lapis analisis dapat jelas fenomena jadi lebih vokal masif era bahan bakar campur e picu kimia etanol buruk masalah lama,negative
ambil busi terus sambit sama jelas situ enak kayak tinggal beli kerja sana sini isi pertalite malah perapianya tidak stabil auto busi masalah pertalite campur etanol kan ngehek,negative
campur etanol,neutral
pertamax turbo pertamina bensin ron aditif performa tinggi resmi tidak kandung air pertamina sangkal kontaminasi air bbm dasar tes baru etanol campur hingga beberapa varian pertamina bagi,positive
pakar universitas indonesia sebut campur ethanol bbm lazim aman guna kandung persen etanol indonesia tidak rusak mesin lama sistem distribusi simpan jaga baik,positive
video sidak wali kota surabaya cak armuji salah satu spbu tengah viral media sosial rekam edar lihat periksa botol isi cair duga campur bbm sebut mungkin ada etanol metanol dalam,positive
bbm campur etanol bisa sebab karat tangki bensin motor utama etanol serap air picu korosi tangki logam resiko lebih tinggi motor lawas campur etanol tinggi guna bbm segar periksa tangki rutin cegah,positive
campur etanol bodoh tidak,negative
campur etanol tidak,neutral
dasar sumber republika lapor resmi bobibos biofuel tanam lokal indonesia bukan sekadar campur etanol bbm klaim punya ron uji lab lebih irit emisi rendah komposisi detail lengkap publik inovasi,positive
dasar sumber lapor esdm artikel resmi bobibos biofuel nabati tanam lokal indonesia bukan campur etanol sederhana klaim punya ron uji lab lebih irit rendah emisi komposisi eksak detail publik inovasi,positive
aku durung komentar kait brebet bensin etanol mungkin satu motor memang tidak rutin servis lalu konsum bensin e akhire kaget campur e liane e kaca kasus oplos tiga motor lebih tahun kyoke mariki banyak baru motor,negative
mobil pakai campur etanol tidak,neutral
memang etanol lebih bersih efek beda tiap mesin kakak kalau motor masih karburator campur etanol justru bisa bikin brebet,positive
kakak kakak jowo tulen campur etanol cfd an ibu kota,positive
etanol banyak kendara rusak masalah tanda etanol jelek campur bahan bakar,negative
jabat bodoh semua bukankah singkong bisa buat etanol campur pertalite,negative
hasil monopoli kompetitor pihak swasta kini ganti main rakyat sendiri antri spbu sekarang konsumen lebih pilih pertamax pertamax turbo vegaku tetap tidak isi pertalite mugo campur etanol banyu ng wetenge jabat badjingan kae,neutral
benar campur etanol e bahan bakar minyak aman kendara negara terap berapa persen,positive
kendara modern biasa rujuk kendara produksi tahun an rancang material tahan korosi tangki plastik logam lap kompatibel campur etanol e kendara tradisional lama pra sering pakai tangki logam,positive
sebab rusak tangki motor bensin pertamina bisa campur etanol e sebab korosi komponen tidak kompatibel kontaminasi air spbu masalah awat filter sumbat busi kotor pertamina ban kontaminasi saran cek,negative
penting paham campur bensin republik indonesia indonesia etanol pakai anhydrous ethanol jenis tidak kandung air bukti aman mesin konvensional seal gasket kendara jangan makan hoax kasih paham dukung transisi,positive
kerja jawab butuh oktan tinggi mesin mesin modern renewable basis biomassa catat kecil kompatibilitas material campur etanol biodiesel konsentrasi tinggi potensi rusak seal selang komponen karet lama mesin,negative
sorry bukan bela bahlil seperti memang kualitas pertamina jelek dunia soal mulai alih etanol buat campur bahan bakar disclaimer aku bukan dukung bahlil,negative
perintah rencana terap bensin campur etanol e langkah tuju bahan bakar ramah lingkung muncul tanya penting semua kendara siap pakai e,positive
ikan daftar kendara tidak bisa guna bahan bakar campur etanol,neutral
jakarta cnbc indonesia dewan energi nasional den ingat penting gandeng sektor manufaktur rencana bijak tingkat campur etanol bahan bakar minyak bbm jenis bensin jadi e implementasi campur etanol bensin indonesia,positive
campur e bbm etanol umum aman mesin kendara modern tingkat angka oktan kurang emisi cowok tidak rusak komponen rancang kompatibel etanol milik nilai energi lebih rendah konsumsi bahan bakar bisa naik,positive
baca buku pamduan jangan beli bensin campur etanol bikin korosi uap lembab khujanan bisa bahaya kalau tank bahan bakar campur etanol,negative
aku tidak i masih urip surabaya mungkin tangki e tidak keramut lembab potensi ngembun pom e mbanyol e onok atus sepeda mogok potensi e siji bensin sing tuku campur etanol,negative
paham khawatir soal bensin ethanol pertamina duga banyak air campur tanah bagai daerah etanol memang mudah serap uap air bisa buruk masalah kelembaban distribusi simpan pertamina uji kualitas,negative
jangan jangan campur etanol pertalite kurang impor dorong energi bersih sama sir miles axlerod cipta allinol lalu menjatuhlan allinol sendiri dunia gantung minyak,positive
campur etanol terap tahun arti tahun campur etanol pertamina berapa bodoh,positive
karat banyak tidak muncul minggu potensi karat kalau isi bbm campur etanol kalau motor tidak pakai lama kalau tiap hari pakai mah aman,positive
menteri energi sumber daya mineral esdm bahlil lahadalia jelas perintah rencana terap bahan bakar campur etanol e campur bahan bakar minyak bbm persen etanol sumber tebu jagung singkong bahlil,positive
viral berita medsos jatim kasus sidak tes bbm pom bensin kata tidak ditemuin campur air tank pom benar mungkin brebet campur unsur etanol bensin tidak cocok sistem bakar mesin umum,positive
esdm pasti mobil tahun atas aman guna bbm campur etanol,positive
yaudah yaudah habis tonton konser blackpink jangan lupa tonton konser siapa tahu dapat voucher isi bensin campur etanol,positive
jadi masalah bukan etanol kendara edar tidak desain konsumsi bbm campur etanol sini letak anjing perintah bahlil asih bijak enak udel tampa mau tahi lapang apa,positive
jakarta cnbc indonesia perintah sedang siap bijak baru guna bahan bakar minyak bbm jenis bensin campur etanol e tanggap sebut pt astra daihatsu motor adm pasti seluruh kendara siap adaptasi,positive
sobat essentials wacana campur etanol bensin bukan baru upaya rupa pernah laku era presiden susilo bambang yudhoyono surabaya kadar campur tidak lanjut soal biaya produksi pasok lengkap,positive
gelap kayak bahlil mahal good looking campur etanol,positive
pernah baca buku padu suzuki sama honda situ tera maksimal etanol beberapa bahkan larang guna campur etanol,neutral
betul dapat indikasi curang bukti tg mawon kalau duga bukan campur air etanol lebih tambah aditif sifat korosif endap kerak tangki jadi injeksi jebol,positive
mungkin bukan campur air etanol kakak larut aditif bbm sebut sifat korisif tangki bensin endap kerak tangki nyumbat salur injeksi,neutral
bukti campur etanol jelek larut dalamair bisa korosif video viral etanol pertalite banyak banget kadar lebih,negative
kok tiba tidak buka gae ngambu luk tok ayo e mati dw nah aku lihat info campur etanol dek nyerep air cmiiw terus tambah mbe udara indonesia sg lembap makin makae punyae wong seng ditaro botol kan misah koyok onk bensin mbe air,positive
etanol murni lab teknis memang relatif mahal proses suling tinggi bioetanol bahan bakar buat massal limbah tebu molases lokal harga bisa lebih kompetitif subsidi perintah campur e e pertamina tuju kurang,positive
eddy jelas etanol justru bikin udara lebih bersih campur etanol turun sulfur tekan polusi jalan target potong emisi karbon nasional,positive
beli bbm murni bukan campur etanol sempat ambil pertamina batal campur etanol,positive
kan kata purbaya harga modal pertalite cuma etanol harus harga jual pertamina turun dong a campur etanol bensin pertalite murni nyata campur,positive
tuntut spbu sebut pertamina perintah bidang esdm amp bumn presiden republik indonesia tuntut bijak bbm campur etanol sebut batal tuntut bahlil pecat,positive
etanol guna campur bahan bakar minyak bbm bensin biasa denatured alcohol tambah zat denaturan bensin cegah konsumsi minum penuh standar bahan bakar contoh e e,positive
etanol pakai campur bbm bukan denatured alcohol,neutral
apa wooozh terus paksa campur pertalite etanol,neutral
etanol energi per liter lebih kecil bbm murni jadi jumlah liter sama bbm campur jarak tempuh jelas lebih pendek please harga bbm rangin kalau harga sama jarak tempuh lebih pendek boncos,positive
pribadi pernah test beberapa jenis bbm pertamina benar cuma pertamax turbo benar arti tidak campur air minim etanol tidak benernya pertamax turbo test selang waktu minggu ron oktan angka arti tidak benar sesuai klaim,negative
kayak memang stock mau jual swasta tahu campur etanol tidak jual jadi lempar spbu merah sendiri storage buat bbm upgrade buat bbm campur etanol,positive
ron bisa bikin gampang banget pakai ron booster bisa masalah bukan ron aditif pakai campur hemat tidak masuk akal banyak contoh etanol atas,positive
begini bahan etanol mau jadi campur bbm bikin rusak kendara tipu bodoh asu bensin pertalulit celaka buang comberan,negative
narasi besar turun emisi jagung amp gula masih impor kok gegaya mau buat etanol campur bbm,negative
bisa jadi kakak antisipasi paling ringan coba cium bau tangki bensin kalau bau sengat banget kayak alkohol fixed campur etanol mending langsung mix sama turbo tap bensin ganti isi bp,positive
signifikan fuel pump motor karbu stroke pakai bbm campur etanol sangat pengaruh bahkan stroke sangat tidak saran bisa serap lumas hingga bikin kering lumas buat piston macet,positive
bogor mulai hari spbu bp akr sedia bbm non subsidi campur etanol,neutral
runut nyata pihak spbu swasta batal ambil kuota bbm pertamina kandung etanol tinggi amp amin sama bahlil soal guna campur etanol bisa ambil simpul siapa main oplos awal tidak perlu main drama memang rusak,positive
wah curiga aku mesti bensin motor cepat habis bensin sekarang campur etanol,positive
spbu beli bbm pertamina apa tidak prosedur tank datang spbu apa langsung cek kandung bbm misal benar tidak campur etanol campur adaktif air apa,negative
jadi apa terang pertamina arti bijak campur etanol tidak jadi alhamdulillah asa tidak enak kayak nyata tidak bakal,positive
moga tidak campur etanol,neutral
campur etanol bukti indonesia bisa mandiri tani makin semangat bumi makin bersih,positive
campur etanol tambah berapa persen bro halo,neutral
mandatori e perlu siap matang tidak timbul beban baru capai campur indonesia butuh pasok etanol besar tara konsumsi bensin nasional produksi negeri siap impor etanol bisa tingkat teknis e aman,positive
masih untung bensin campur etanol kalau bensin murni mahal sih,negative
perintah sendiri aku campur etanol shell dkk tidak mau beli bbm pertamina masak berita ditayangken media masih tanya atas dasar apa,neutral
etanol etanol ajar pintar dong jangan mau bodoh viral sesat biasa orang kelompok bela kalah pilpres perintah pertamina terus inovasi tuju energi bersih korban penting rakyat kecil program campur,negative
benar campur etanol jadi biang kerok motor brebet kata pakar,positive
pertamina patra niaga tegas bahan bakar minyak bbm spbu aman ban duga pertalite oplos hingga sebab motor brebet jawa timur dirut pertamina patra niaga ega ikhlas putra pasti tidak campur etanol bbm jenis pertalite,negative
penasaran orang tahu tidak sih campur bensin etanol tahu tidak kondisi komponent kendara sekarang dukung bahan bakar campur heran baru dar lihat langsung bilang sesuai standar standar mana kamu pakai pea,neutral
oiii internetmu campur pertalite sama etanol brebet,neutral
kalau campur etanol kayak mending beli deh filter lebih bagus pertamini harus,positive
wajar kalau khawatir banyak keluh brebet pertalite belakang jatim mungkin campur air aditif mangan bp memang etanol pakar bilang aman buat kendara modern tidak pengaruh performa kalau mau hindar coba pertamax cek servis,positive
dapat pribadi boleh tidak tuju bbm plat merah masalah bukan campur etanol benar lama cemar air bukan betul jadi kala hujan deras hari bisa jadi tangki simpan spbu kondisi kurang baik,positive
kendara buat tahun berapa spbu swasta batal beli bbm pertamina cuma masalah barang datang beda pesan masalah orang sakit jiwa bikin narasi soal efek buruk campur etanol makanya batal,negative
bukti kasus mesin rusak campur etanol bahlil masih ngegas maksa rakyat pakai bbm ber etanol ilmu bantah kencang tanggung jawab ringan maaf jiaaah komisaris pertamina malah masih sibuk urus sih mantan,positive
bisa campur air bisa kena sabotase kan masih selidik kalau cuma campur etanol benar masaih standar maksimal motor atas tahun bisa guna etanol lebih,positive
salah satu tuju tidak langsung bijak tingkat campur etanol misal e e e bisa dorong jual mobil baru utama dukung teknologi flex fuel bisa pakai campur etanol tinggi,positive
bodoh amit benar ndasnya atos entar kalau pertamina bangkrut tidak mau beli campur etanol jadi sasar pihak swasta ikut makek etanol kalau tidak bajing apa layak sebut orang,negative
tidak jujuran orang bahlil lahadalia campur etanol bbm putus makna etanol campur bbm harus sebut efek tidak semua mesin jenis kendara dapat terima bbm oplos,negative
jadi masalah indonesia tidak terap skema flex fuel bisa bensin campur bensin etanol bensin pertamina masih banyak oplos sama campur air cuma akal busuk bahlil komplot meski bisa ngebabat hutan dapat proyek,negative
benar batas umur kendara mayoritas armada indonesia masih gantung model lama karburator rentan korosi serap air etanol campur rendah e e umum kompatibel kendara tua bahan bakar segar kadar lebih tinggi,positive
etanol duga campur air begini tambah etanol sifat higroskopis alias serap molekul air,neutral
waspada fenomena busi motor cepat mati isi pertalite etanol belakang banyak banget keluh busi motor dadak masalah rutin pakai pertalite duga kandung campur etanol kenapa bisa jadi etanol,positive
temu ujung perkara etanol pantas campur bbm sama singkong,neutral
aduh mendagri minta tinggal beras alih jagung singkong bodoh bilang jagung singkong buat bikin etanol campur bbm terus bijimana benar mending kalian tanam jagung amp singkong jadi jabat,positive
simpan spbu kayak update buat bisa simpan bbm kandung etanol tinggi lama oita tidak tahu berapa campur ramai rencana etanol,positive
indonesia bakal wajib campur etanol bbm sumber admin pangkas emisi karbon indonesia bakal wajib campur etanol bbm dunia industridunia industri,neutral
kok kerak warna tahu masih awam rusak bahan bakar campur etanol ada ikat etanol air hambat bakar akibat karat tidak lihat karat,negative
jumlah investor global tarik investasi proyek bioetanol indonesia wacana guna campur bbm etanol e toyota jadi salah satu usaha nyata minat bangun pabrik etanol dukung kendara bahan bakar campur etanol,positive
perintah cepat rencana kembang industri bioetanol nasional etanol persen e target mulai terap tahun campur bahan bakar bensin menteri agraria tata ruang kepala badan tanah nasional atr bpn nusron wahid,positive
pakar bantah isu campur etanol pertalite sebab motor brebet jatim,negative
nah kan padahal perspektif awal campur etanol bensin manfaat bukan buka lahan baru,positive
penting apa beliau banget bensin campur etanol,positive
literatur baca media kompas bayar jadi masal jatim jenis pertalite mungkin campur etanol jelas bisa bantah pertaminan campur etanol bbm non subsidi harga etanol sendiri lebih mahal tidak,neutral
tebu jadi prioritas pabrik bahan baku etanol bakal guna penuh butuh gula nasional rencana campur bbm e,negative
dasar telusur nyata bahlil lahadalia etanol campur bbm kurang emisi impor benar umum detail mandat as rata rata e e bukan wajib e brasil e e bukan b b mungkin salah sebut india target e thailand,negative
guna etanol campur bahan bakar e e umum aman kendara modern tahun atas epa studi bantu kurang emisi beberapa keluh rusak muncul kendara lama non flex fuel,positive
memang kendara lama operasi indonesia dapat penysesuaian buat guna bbm campur etanol kan,positive
banyak kendara rancang guna bahan bakar campur etanol bahkan jumlah pabrikan kendara tegas larang guna,positive
lapor ratus motor mogok brebet jatim bojonegoro tuban lamongan sejak oktober usai isi pertalite duga campur etanol pertamina bantah etanol pertalite pakar itb bilang kecil mungkin perlu uji lab sebab,negative
menteri suruh ajar masalah tehnik mesin utama mesin sepeda mobil baik mungkin mesin sepeda amp mobil bisa pakai bbm campur etanol mesin sepeda amp mobil tidak bisa pakai bbm campur etanol bagaimana jangan disamaratakan,positive
bahan bakar kasih campur etanol,neutral
memang kalau minyak tidak masalah jadi masalah campur etanol iklim tropis lemban tahu sendiri sekarang bbm pakai campur etanol air masuk tangki makin banyak lil bahlil masa isi bensin fulltanki terus,positive
loh kena campur etanol makanya jadi ndet ndet motor kemarin kalau tidak salah ingat bijak sih buahlil tidak sih saran etanol etanol lebih ramah bagus gila efek malah jadi begini,negative
bisa koreksi harga pertalite kata banyak kandung air etanol harga pertalite sendiri campur etanol memang berapa kalau negara jual murni campur harga lebih murah campur apa jangan harga etanol lebih tinggi bahan dasar,positive
lailahaillallah gin gengsi ngakuin kurang amp salah sendiri semua tabrak paksa buat nutup malu bensin campur etanol plus minus dipaksain wajib dadak merhatiin kendala dirasain masyarakat sih memang kamu semua jahat banget,positive
etanol biomassa tebu jagung anggap lebih ramah lingkung bensin murni sifat baru kurang emisi cowok netto siklus hidup campur e bisa turun emisi ayo rumah kaca hingga dasar studi epa,positive
kandung etanol soal kan swasta wajib beli pertamina pertamina ngejual bensin campur etanol tuju beli bp vivo,neutral
bahlil benar bodoh bilang etanol jelek tidak cuma tidak cocok pakai campur bbm indonesia pabrik priduksi kendara indonesia kompatibel etanol cari untung buat mafia migas besar cara mudah murah,negative
kendara lawas indonesia mayoritas pre campur e risiko sebab korosi sistem bahan bakar etanol serap air milik bisa rugi biaya baik lebih tinggi konsumsi bbm naik akibat densitas energi rendah beban,positive
campur etanol e aman bagi besar kendara modern indonesia avanza xpander tidak rusak mesin utama etanol milik densitas energi lebih rendah konsumsi bbm jadi lebih boros bukan lebih baik performa,positive
etanol campur e umum aman mesin mobil modern bisa rusak mesin lama kecil non kompatibel korosi serap air fase pisah studi tunjuk manfaat emisi rendah resiko konsentrasi tinggi cek kompatibilitas,positive
pertamax abang soal campur etanol base fuel jadi pertalite dinaikin kadar,negative
perintah terus dorong kembang industri bioetanol nasional target terap campur bensin etanol persen e mulai menteri agraria tata ruang kepala badan tanah nasional atr bpn nusron wahid sampai banyak ribu hektare lahan,positive
jadi mungkin maksud campur etanol bbm baik butuh siap industri guna bbm jenis sebut,positive
campur etanol bbm e e punya lebih lebih ramah lingkung kurang emisi sumber baru kurang energi lebih rendah jadi konsumsi bbm lebih boros bisa korosi mesin tidak kompatibel produksi bisa pengaruh,positive
campur etanol bagus bbm,positive
justru curiga campur etanol pertamax fungsi etanol naik angka oktan kalau pertalite tidak terlalu butuh ethanol memang ron rendah,positive
perintah kemarin malah wajib campur etanol alas negara begini sekolah tinggi tinggi meski guna nusa bangsa duduk perintah orang orang bukan bidang,positive
standar perintah kan campur etanol arti tulis prosedur campur etanol lalu laksana jadi pertalite terima masyarakat campur etanol terus muncul masalah brebet misal telusur periksa,negative
menteri energi sumber daya mineral esdm bahlil lahadalia menep tuding sebut guna etanol campur bahan bakar minyak bbm dapat rusak mesin kendara tuding balik isu sebut hembus pihak pihak tidak kuota,neutral
nyata bahlil benar umum campur etanol e tidak rusak mesin kendara modern as eropa kendara rancang kompatibel standar bahan bakar ketat cegah korosi serap air lebih sana etanol kualitas tinggi,positive
kalau periksa sesuaindg tentu arti campur bbm etanol biang kerok banyak kendara mogok brebet kendara tidak kompatibel etanol,positive
etanol campur bbm bisa rusak mesin kendara kadar tinggi misal kendara lama tidak kompatibel dampak masuk korosi rusak seal karet turun efisiensi kendara modern biasa aman e saran cek,positive
campur etanol indonesia pertamax lebih spbu jawa perintah rencana wajib e nasional mulai sumber lapor pertamina menteri esdm,positive
menteri energi sumber daya mineral esdm bahlil lahadalia menep tuding guna etanol campur bahan bakar minyak bbm dapat rusak mesin kendara tuding balik isu sebut hembus pihak pihak tidak kuota impor pangkas,neutral
bahlerrr motor brebet parah ngisi habis isi pertalit campur etanol kamu bahlerrrr,negative
harus cek bbmnya campur bahan kimia tidak contoh etanol,neutral
mobil lama utama model karburator an rentan rusak campur etanol etanol bisa sebab korosi degradasi karet seal tarik air picu karat masalah susah start turun performa e biasa aman awat hindar e,positive
bagaimana mobil lama ada campur etanol,positive
mungkin paman ramai campur etanol tidak begini kok cari spbu swasta habis akhire daerah kabupaten temu indostation coba isi sekarang aman no mbrebet,positive
mungkin bikin brebet campur etanol bahan bakar jadi bisa pengaruh mesin dkk,neutral
ramai isu bbm campur etanol jadi canda tanya chatgpt kondisi negara lain,negative
teoritis murni etanol sih h alkohol higroskopis arti mudah serap air sebab korosi logam aluminium baja campur modifikasi mesin bakar internal etanol tingkat oktan ikat oksigen bantu,positive
bagaimana pak menteri bahlil tanggungjawab kamu jaremu campur etanol standar nyatane podo keluh semua please campur ethanol berapa please ojo susah rakyat kalau tidak iso bantu ojo bantu luwih apik banding nyusahno rakyat,negative
kepala kau tidak benar kamu tahu tidak sih kendara tidak boleh isi bahan bakar campur etanol orang kapan sih ganti jijik banget sumpah gwe bisa pikir tidak sih kamu,negative
