clean_tweet,sentimen
perintah target terap bbm campur etanol mulai tahun depan menteri koordinator bidang pangan zulkifli hasan kata produksi tebu singkong tengah gencar dukung program langkah sebut yakin bisa gerak ekonomi rakyat,positive
indonesia mulai pasuk era bahan bakar hijau honda jadi salah satu produsen dukung langkah astra honda motor ahm pasti seluruh motor baru siap guna bensin campur etanol e bagi komitmen tuju energi bersih,positive
toyota klaim mobil mampu toleransi hingga etanol mitsubishi tegas kendara bahan bakar bensin dapat guna campur etanol hingga masalah arti,neutral
guna bahan bakar campur etanol e tengah jadi perhati publik respons toyota mitsubishi pasti kendara aman guna bbm jenis sebut sesuai standar pabrikan,positive
menteri esdm tengah siap bijak wajib campur etanol persen e bbm sebut sebut langkah tuju energi bersih mandiri energi nasional pks ingat bijak wajib campur etanol e tidak bingkai langkah,positive
entah wajib campur etanol bbm guna kendara,neutral
zulkifli hasan campur etanol justru dongkrak harga komoditas tani lewat,neutral
langkah tunjuk serius dunia kurang gantung bahan bakar fosil tidak campur etanol bukti bantu turun emisi ayo rumah kaca inggris misal alih e kira mampu kurang hingga,negative
guna etanol campur bahan bakar kendara motor e e kini bukan sekadar eksperimen jadi praktik umum banyak negara amerika serikat guna e luas jerman jual istimewa e brasil bahkan terap e,positive
toyota indonesia rencana kembang teknologi dukung guna bbm campur etanol e teknologi bukti efisien ramah lingkung bagai negara tiktok jakartanow,positive
teliti sae bukti campur etanol e e tidak rusak mesin kompatibel bantu kurang polusi akun ruditoaau aus mesin tetap sama bensin murni asal mesin sesuai spesifikasi source tiktok baru hari,positive
polemik campur etanol bbm masih gulir bijak ambil kurang emisi karbon gantung republik indonesia bbm impor utama bensin etanol bahan baku tebu singkong jagung harap dapat kontribusi positif lantar anggap lebih,positive
tidak perlu cemas soal bbm campur etanol hasil riset society of automotive engineers sae tunjuk guna bahan bakar e e tidak rusak mesin kompatibel bahkan mampu tekan polusi udara signifikan tiktok baru hari,positive
e langkah kecil bumi besar campur etanol bikin bensin lebih bersih mesin tetap aman bumi makin hijau indonesia mulai lewat pertamax green kamu siap isi tangki ubah,positive
ahm pasti seluruh model motor baru siap guna bensin campur etanol e langkah jadi bukti komitmen honda dukung transisi tuju energi lebih bersih ramah lingkung instagram news nthego,positive
toyota kini mitsubishi motors indonesia pasti seluruh mobil bensin pasar aman guna bahan bakar campur etanol hingga e sesuai spesifikasi tiap model,positive
terus tingkat tahun program etanol thailand rupa bijak nasional resmi perintah konsisten beri subsidi dorong campur etanol makin luas hingga e jadi bahan bakar utama pasar,positive
honda pasti motor baru siap guna bensin campur etanol dukung energi hijau,positive
zulhas bbm campur etanol wajib mulai tahun depan,neutral
polemik campur etanol bbm masih gulir bijak ambil kurang emisi karbon gantung republik indonesia bbm impor utama bensin etanol bahan baku tebu singkong jagung harap dapat kontribusi positif lantar anggap,positive
polemik campur etanol bbm masih gulir bijak ambil kurang emisi karbon gantung republik indonesia bbm impor utama bensin etanol bahan baku tebu singkong jagung harap dapat kontribusi positif lantar anggap,positive
bbm campur etanol e jadi perhati toyota amp mitsubishi pasti kendara aman guna e sesuai rekomendasi pabrikan toyota etanol tidak masalah mitsubishi kendara bensin bisa konsumsi etanol hingga source suarapublikid,positive
kenal etanol bahan campur bensin perintah rencana terap campur etanol persen bensin dukung tahan energi sekaligus kurang emisi karbon ikut lengkap etanol laman,positive
guna bahan bakar campur etanol persen e nilai bawa dampak positif kendara keluar tahun atas,positive
perintah rencana terap bahan bakar bioetanol e bensin campur etanol menteri esdm bahlil lahadalia kata bijak bisa hemat konsumsi bbm hingga juta kiloliter kurang impor bahan bakar produksi bbm,negative
direktur ebtke eniya listiani bensin campur etanol persen terap non pso tahun,neutral
bahlil lahadalia tanggap kritik soal bijak campur etanol bbm,positive
kasus pertamax rugi triliun rupiah duit rakyat indonesia bukti sengaja campur etanol jual lebih mahal ganti semua personilnya audit investigatif internasional atas layak harga bbm pertamina,neutral
anak sekarang banyak makan makan campur etanol radio aktiv sama formalin,neutral
kurang komparasi campur etanol bbm lumrah bahkan bagus sisi lingkung,positive
kurang literasi jadi asal sindir padahal shell pakai e alias campur etanol bro justru bagus dong makin ramah lingkung lebih bersih buat mesin,positive
sepeda motor kalian lebih canggih tahun tinggi banding zx r bisa telan campur etanol tangki motor,positive
kalau nyenyenye arti tidak suka jawab netral paham tetap fokus fakta campur etanol bbm bisa hemat devisa impor hingga rp triliun per tahun dasar estimasi esdm meski butuh infrastruktur tambah mau diskusi pro kontra lebih,positive
komentar lelucon kasar main meme satir bijak campur etanol bbm menteri bahlil faktual bioetanol kurang impor bukan lucu vulgar gantung selera,negative
perintah wacana apa bahan bakar campur etanol siap siap motor tidak tidak cocok bahan sebut jadi era hancur motor tidak,negative
mesin makin efisien bumi makin bersih toyota mitsubishi honda kini siap pakai bahan bakar e campur etanol tebu singkong jagung langkah kecil tuju indonesia mandiri energi,positive
pt pertamina patra niaga sambut positif rencana manfaat bahan bakar minyak bbm kandung bioetanol persen kenal e,positive
menteri energi sumber daya mineral esdm lalu direktur jenderal energi baru baru konservasi energi ebtke eniya listiani dewi sebut mobil indonesia teknis bisa guna bbm campur etanol hingga persen perlu ubah,positive
etanol bbm uji aman sesuai sini campur justru bantu bakar lebih bersih kurang emisi tidak bikin mesin rusak kalau bahan bakar sesuai spesifikasi pabrikan jadi bukan salah bijak salah paham baca data,positive
pertamina patra niaga akselerasi layan spbu edukasi bioetanol publik,neutral
kelapa sawit tidak cuma minyak goreng dapur bisnis besar biofuel diesel biosolar sama hal jagung bisa olah jadi etanol campur bahan bakar bensin smuanya proyek samar nama jadi food estate bukan,negative
nevi zuairina bijak campur etanol perlu terap siap hati hati anggota komisi vi dpr republik indonesia hj nevi zuairina dukung rencana perintah terap campur etanol persen bbm e langkah tuju energi bersih kurang impor,positive
kalau masih campur etanol pertamina perlu beri sanksi nyata bukti campur etanol nepalkan lebih cocok lihat,positive
baik ambil sampel pertalite teliti dianalisa kandung etanol bukti kandung etanol pidana orang pasti tidak campur etanol pertalite,positive
kalau base fuel ron nyata capai campur etanol bukan base fuel murni jelas fabby masalah kalau beli misal spbu swasta punya formula aditif sendiri campur luar sepakat bisa bikin kualitas bensin ubah bahkan luar,negative
utas bbm etanol e solusi bersih problem baru sobat essentials tahu perintah rencana wajib campur e bensin tahun terap kata sih kurang impor minyak amp,positive
campur etanol persen bbm aman tidak buat mesin kendara kata ahli,positive
bahlil jelas strategi optimal energi baru campur etanol bbm dukung masa depan energi bersih indonesia like amp retweet dukung ubah positif,positive
bahlil jelas manfaat campur bbm etanol energi lanjut retweet follow info baru,positive
tuju tidak sama terap bbm campur etanol e,neutral
dirjen migas menteri esdm laode sulaeman minta spbu swasta shell indonesia beli bahan bakar dasar base fuel pertamina tolak pasok sebut bukan kualitas masalah internal usaha tegas campur etanol bbm aman,negative
mana berani prabowo copot bahlil wong campur etanol usul wowo aku sih tidak berat bagi mesin kendara bisa baik asa tidak sekali luka trauma bawa mati opresi perempuan,positive
asosiasi tani tebu rakyat indonesia aptri nilai bijak mandatori bahan bakar campur etanol persen e bisa buka peluang baru tani tebu baca sini kan,positive
kemarin kabar campur etanol baik sekarang pasti tidak etanol bagaimana mau percaya,neutral
sini satu satu pilih konsumen beli bbm spbu swasta spbu swasta mati atur perintah milik spbu india minta usaha migas sedia bahan bakar campur etanol bulan bulan musim hujan,neutral
defensenya baik campur etanol minum,positive
campur etanol bbm sulfur tinggi standar euro indonesia bisa tingkat oktan kurang emisi cowok hc tidak turun kadar sulfur sendiri etanol rancang mesin euro asumsi euro typo campur risiko rusak,positive
bijak etanol baik jalan hati hati transparan pihak mandiri energi nasional,positive
baca isi pertalite pakai campur bioetanol omong omong kok jadi alergi sama etanol shell mau beli bensin pertamina nyata tidak sesuai sama spek mau murni campur memang kasih campur etanol pertamina,positive
pertamina rugi selalu padahal rakyat beli bensin tidak pernah hutang dagang bensin ecer untung bukan usut malah buat inovasi etanol campur bbm lama lama arak jadi bahan campur,negative
bbm fuel base awal tinggal kerak mesin iring kembang campur aditif bisa diminimalisir apa tidak pikir e dampak buruk etanol tidak pikir jadi ingat awal migrasi mitan ayo melon heboh,negative
bukan dar kandung ethanol begini eropa as campur etanol e e e ikut standar ketat astm as en eropa atur kadar air murni etanol kandung sulfur hingga kadar logam berat etanol anhidrat,positive
perintah siap bensin campur etanol e jelas pakar menteri lingkung hidup,positive
bbm campur etanol bisa bantu kurang polusi udara akibat sulfur etanol hampir bebas sulfur campur misal e lus kadar sulfur bensin turun emisi so efektivitas gantung regulasi kadar sulfur asli bensin,positive
jadi apa etanol bbm benar alkohol tumbuh tebu singkong jagung terus campur bensin buat kurang emisi impor minyak sekarang pertamina mulai pakai campur e lewat pertamax green depan mau naik e,neutral
kata bensin bakal campur etanol memang kenapa sih aman tidak buat kendara baca akhir meski tidak salah kaprah soal bbm campur bioetanol e a,positive
pakar nilai bijak etanol bahlil langkah nyata tuju energi hijau bijak menteri energi sumber daya mineral esdm bahlil lahadalia dorong guna etanol campur bahan bakar minyak bbm nilai langkah konkret tuju energi hijau,positive
menteri hanif faisol sebut campur etanol kurang kandung sulfur bbm lewat news,neutral
dasar sumber afdc penn state extension campur etanol e kurang efisiensi bahan bakar etanol punya energi lebih rendah bensin arti e punya energi bensin murni jadi konsumsi naik sedikit jarak sama efek,negative
nevi zuairina bijak campur etanol terap tahap hati hati topp bu customer care,positive
jurnalpatrolinews jakarta rencana perintah terap bijak mandatori bahan bakar campur etanol besar e produk bensin mulai jadi perhati publik kalang industri energi,positive
etanol bisa hemat bbm import berapa besar etanol apa produksi dalam negeri kalau pakai etanol harga bbm apa bisa lebih rendah etanol campur pertalite pertamax kata tidak subsidi,positive
mau etanol kali lebih mahal mau mau bodoh pakai campur mtbe aman mesin murab racun lingkung,negative
hi kalau tidak pakai campur etanol pasrah pakai campur mtbe racun turun performa banding dampak lingkung,neutral
hi mesin kendara tahun an lebih bandel mesin baru kualitas logam buruk kenapa malah protes campur etanol ramah lingkung bukan protes produsen kendara sunat kualitas mesin,positive
fitra eri tolak campur etanol luas etanol milik densitas energi lebih rendah bensin murni turun tenaga mesin tingkat konsumsi bahan bakar khawatir etanol tarik air sifat korosif potensi rusak komponen mesin,positive
hi kenapa fitra erri sebut ahli mesin malah tolak campur etanol bensin,neutral
hi mana lebih ramah lingkung naik oktan bensin campur etanol mtbe,positive
sekarang mungkin besok bodoh bilang bbm campur etanol pertamina mungkin tau guna bbm campur etanol,negative
bahaya campur etanol,neutral
ini akal an buat issue etanol jelas campur etanol lebih banyak rugi malah mau tingkat kadar bbm negeri bbm murni kandung etanol kemarin kan beli pertamina cara impor sekarang barang,positive
perintah tingkat campur etanol bensin khawatir parah deforestasi lingkung,neutral
etanol ch ch lebih polar larut air bensin campur ch ch ch ch ch ch ch ch ch ch ch ch ch ch ch non polar tidak larut air,positive
menteri campur etanol kurang kandung sulfur bbm,negative
kalian percaya pertamina pertamina pasti tidak campur etanol pertalite,neutral
benar etanol lama pakai campur bbm banyak negara as e etanol umum guna brasil campur hingga e e kendara fleksibel negara india china eropa terap tingkat oktan kurang,positive
benar negara etanol pakai buat campur bbm,positive
wakil ketua majelis musyawarat rakyat mpr eddy soeparno ingat perintah jangan impor etanol campur bahan bakar minyak bbm jangan etanol sebut produksi volume butuh negeri paksa,negative
jangan kasih tahu campur etanol naik,neutral
bodoh kau etanol sama alkohol memang ramah lingkung bodoh kalau minum kamu kali coba minum bbm produk as pakai campur racun mtbe kritik sah pakai otak,negative
honda nyata motor model baru rancang bisa pakai bbm e campur etanol benar langkah maju dukung transisi energi amp kurang gantung bahan bakar fosil,positive
pabrikan motor tidak komplai campur etanol bbm mesin aman aman,positive
begini lur etanol jadi campur bbm bikin tidak gantung impor minyak mentah etanol bisa produksi sendiri,negative
biosolar campur persen minyak sawit tidak masalah tidak karat bocor turun performa etanol cuma persen tidak rasa pengunaan hari hari,neutral
lihat makin langka bbm makin warga bernapsu bakar bensin campur etanol,positive
wajib tahu campur etanol,neutral
pertamina pasti tidak campur etanol bahan bakar pertalite jual spbu pj corporate secretary pertamina patra niaga roberth mv jelas pertalite bensin ron hasil campur komponen hidrokarbon kilang bukan bioetanol tegas,positive
bukan tidak mungkin tiap tahun kalau campur etanol bengsin dipush lebih banyak,positive
bodoh kau masalah produsen nyunat kualitas logam salah etanol kendara tahun an aman bos kok malah bodoh nyefong minta pakai campur racun mtbe kalau kamu tidak bodoh mah protes produsen kendara kenapa kualitas jadi busuk,negative
buzzer aseng begini kasih atur pakai bahan ramah lingkung malah nyefong pakai campur mtbe produk as sangat racun as sendiri larang pakai mtbe wajib pakai etanol kok malah jual indonesia tetap pakai bahan racun sebut,positive
harga etanol tara minyak bumi dimurahin bagaimana memang mau pakai campur mtbe produk as lebih murah sangat racun,positive
mending sedikit lebih boros aman ramah lingkung tidak racun produk as pakai campur mtbe bagi negara bagi as pakai mtbe larang wajib pakai campur etanol kok malah pasar indonesia pakai campur mtbe sangat racun kan bodoh,positive
toyota nilai debat soal bbm pertamina kandung etanol terlalu lebih wakil presiden direktur tmmin bob azam kata luar negeri campur etanol bahan bakar justru jauh lebih tinggi mulai e e thailand hingga e bahkan e,positive
beberapa negara guna etanol campur bensin kendara indonesia brasil e e hingga e amerika serikat e e india china pilot beberapa kota thailand e e kanada argentina negara uni eropa prancis,neutral
pertamax green kandung etanol harga rp l geetuu he he he pertamina pasti tidak campur etanol pertalite,negative
campur etanol mentok indonesia bisa rusak tank etanol cair air jadi bisa buat lebih cepat tank air ada bawah makanya rusak cepat,positive
waspada banyak konten sesat pertalite tidak campur etanol,neutral
masih banyak tanya kena campur etanol pertalite misal berapa kurang tenaga mesin akibat campur etanol etanol bensin bisa timbul rusak mesin akibat etanol bisa ikat air udara,negative
pakar otomotif itb yannes martinus pasaribu sebut bahan bakar campur etanol persen e aman guna mobil keluar sesuai standar mesin euro mobil keluar saran pakai etanol persen e periksa,positive
dampak campur etanol bbm dirasain banyak negara langsung hasil lingkung lebih sehat,positive
bodoh apa negara eropa amerika tolak bbm campur etanol jabat negara kembang keras kepala lagak tahu benar dapat pikir deh kalau kamu habis beli mobil bagus terus isi bbm busuk apa tidak malah rugi beli mobil mahal,negative
dampak negatif campur etanol pertalit,negative
guru besar fakultas teknik mesin dirgantara itb tri yus widjajanto ikut bahas kait guna etanol campuan bbm,neutral
justru campur etanol buat kurang impor bbm murni dorong industri tebu amp jagung lokal perintah bangun ekosistem bioetanol meski tani dapat pasar bukan malah kasih untung impor arah bijak mandiri energi bukan balik,positive
tengah pro kontra soal campur etanol bbm perintah umum konsumsi pertalite tahun turun nyata malah non subsidi jual tingkat,positive
beberapa negara pakai campur etanol brasil e as e kanada prancis china india thailand argentina baru vietnam alih e tahun indonesia rencana e dampak positif kurang emisi lebih ramah lingkung negatif bisa korosi komponen khusus,positive
bbm campur air etanol bisa pisah lalu fase separasi biar campur endap lapis bawah air etanol lebih berat bisa kuras sedot lapis atas bensin kadar etanol lebih rendah murni lebih lanjut guna aditif,positive
soal ada bbm tidak sesuai spek minta konsumen geser soal baik buruk campur etanol bbm hingga mau bikin bijak mandatory minimal kandung etanol bbm hadehhhh,positive
simpan terlalu lama campur bbm etanol bisa picu korosi karat bagi logam sistem bahan bakar turut kondisi lebih risiko motor keluar lama guna material tahan etanol,negative
bukti mobil lama pak campur etanol bbm,positive
klaim dasar etanol punya energi lebih rendah bensin jadi campur e bisa turun tenaga mesin sedikit tingkat konsumsi bbm sumber eia oktane lebih tinggi bisa bantu performa mesin tentu transisi etanol,positive
nyata etanol campur tidak salah dong sebut bbm oplos harga mahal,negative
tri yuswidjajanto pakar otomotif energi institut teknologi bandung jelas teknis kendara indonesia siap guna bensin campur etanol hingga persen kalau etanol harga bbm bisa turun dong,positive
benar banyak negara as e brasil hingga e murni negara eropa guna campur etanol bbm efisiensi lingkung vietnam bahkan alih total tahun sumber wikipedia amp lapor,positive
campur bbm etanol lebih aman guna kendara tenaga listrik,neutral
antisipasi korosi tangki akibat campur etanol bbm indonesia e e sedang dorong perintah saran modifikasi ganti tangki bahan anti korosi plastik coated steel upgrade selang seal amp pompa bbm material tahan etanol misal,negative
bodoh bilang tidak negatif dampak negatif utama campur bbm etanol potensi rusak komponen bahan karet plastik korosi tangki salur bahan bakar konsumsi bbm lebih boros kandung energi lebih rendah,negative
nyata sebut bagi besar benar dasar sumber cnn indonesia afdc etanol dapat kurang tenaga mesin turun energi campur e sebab rusak korosi mesin lama serap air hingga karat,positive
campur etanol bbm cari untung kalau tidak campur sedikit uang oleh,negative
beberapa negara guna campur etanol bbm bensin brasil hingga e amerika serikat e e india e tiongkok kolombia negara eropa prancis jerman e vietnam rencana alih penuh tahun indonesia target e,positive
sebut negara bbm guna campur etanol kata sih pentol korek bahlil,neutral
campur etanol rendah e banyak kendara modern keluar sistem injeksi tidak perlu spesifikasi khusus aman guna material kompatibel kendara lawas mesin kecil bisa risiko korosi,positive
urus etanol kenapa baru ribut sekarang,neutral
nyata menteri esdm bahlil lahadalia benar banyak negara guna campur etanol e bbm as standar banyak negara bagi inggris sejak thailand wajib india capai kini e eropa prancis jerman brazil,positive
kemarenn oplos entah pakai campur apa sekarang oplos pakai etanol aduh entah apa jadi heran kok presiden diam lihat laku lebih baik import mesin rusak,positive
bagi besar mobil modern indonesia toyota avanza xpander model sejak an aman pakai campur etanol hingga e kadar lebih tinggi e e butuh kendara flex fuel modifikasi anti korosi cek buku pandu mobil,positive
campur etanol bensin e punya efek positif kurang emisi polutan tingkat oktan anti knocking lebih ramah lingkung baru negatif turun efisiensi bahan bakar mileage kurang bisa korosi komponen mesin tidak,positive
beberapa negara guna campur etanol bensin amerika serikat e umum brasil e wajib india target e thailand argentina kolombia e negara eropa swedia prancis e sedia brasil as produsen,positive
suruh jawab arti base fuel apa kamu kalau jual base fuel jual base fuel campur apa buyer butuh sesuai minta bisa racik bbm sesuai standar performa proses campur etanol bisa masing buyer racik bbm,negative
kata fitra eri etanol aman guna bahan bakar asal sesuai standar takar teknologi mesin modern rancang kompatibel campur etanol jadi tidak perlu khawatir lebih,positive
kata fitra eri etanol aman guna bahan bakar asal sesuai standar takar teknologi mesin modern rancang kompatibel campur etanol jadi tidak perlu khawatir lebih,positive
angka jauh bawah batas toleransi mesin kendara modern tidak perlu masalah guna etanol bbm bukan baru banyak negara jauh lebih maju terap campur bahan bakar basis bioetanol,positive
campur etanol bbm bukan sekadar inovasi jalan daya ekonomi rakyat,positive
perintah wajib campur etanol bbm begini dampak kendara,neutral
klaim bagi besar benar banyak negara guna campur etanol bahan bakar brasil e e as e e india e thailand e e argentina e jerman amp prancis e filipina e vietnam e china campur rata rata,positive
menteri energi sumber daya mineral esdm bahlil lahadalia tegas etanol layak guna campur bahan bakar minyak bbm turut bukti banyak negara lebih pakai campur etanol bensin,positive
benar campur etanol bbm bisa buat konsumsi lebih boros etanol punya energi lebih rendah bensin murni campur e turun efisiensi efek minimal hampir tidak asa motor cek spesifikasi,positive
analisis campur etanol e bensin punya sisi positif negatif kendara motor lebih lebih ramah lingkung kurang emisi cowok oktana lebih tinggi kurang gantung minyak impor kurang efisiensi bahan bakar sedikit,positive
guna etanol bbm campur e milik dampak lingkung positif kurang emisi ayo rumah kaca hingga banding bensin murni bakar lebih sempurna sifat baru negatif produksi etanol jagung bisa sebab deforestasi,positive
harga bioetanol campur bbm atur perintah via hip esdm rp liter oktober biasa bahan nabati energi etanol teknis industri lab jual bebas pasar online harga lebih tinggi rp liter,positive
harga bioetanol campur bbm indonesia oktober rp per liter dasar hip resmi menteri esdm harga turun rp september etanol teknis bisa capai rp liter pasar online,neutral
lewat campur etanol bbm tani kerja lokal punya masa depan lebih cerah,neutral
campur etanol buat kejar jadi ron berapa oplos kualitas paling jelek sekali asia harga tidak lebih murah pakai malah makin boros mesin bisa makin cepat rusak kurang bajing bagaimana coba,negative
guru besar itb sama amat ekonomi bijak publik beri pandang kena bijak campur etanol bbm gulir menteri bahlil,positive
dasar umum resmi menteri esdm bahlil oktober bijak e mandatori tuju presiden prabowo bukan sekadar harap wajib campur etanol bbm mandiri energi sumber cnbc kompas regulasi euro,positive
beberapa negara pakai campur etanol bbm as e brasil e india e target e ue e e china e beberapa provinsi indonesia rencana e industri otomotif siap kendara lokal bisa pakai hingga etanol masalah kata,neutral
pertamina guna bioetanol etanol bahan organik tebu singkong campur beberapa bbm misal pertamax green etanol pertalite resmi nyata tidak kandung etanol dasar nyata pertamina,negative
campur etanol rendah e umum aman mesin kendara modern bisa sebab korosi lama non kompatibel pertamina tegas pertalite tidak campur etanol hoaks cek sumber resmi info baru,positive
perintah tengah siap peta jalan guna etanol campur bahan bakar minyak bbm menteri energi sumber daya mineral esdm bahlil lahadalia jelas campur etanol besar persen bbm tuju kurang gantung impor,positive
legislator minta perintah tidak impor etanol campur bbm e,neutral
sedikiiit lebih boros performa mesin lebih jaga ramah lingkung performa mesin lebih jaga oktan ron pertalite oktan pertamax oktan etanol campur pertalite pertamax etanol naik oktan pertalite pertamax oktan,positive
bbm bakal ubah bahlil wajib campur etanol siap siap harga naik i trijaya update,positive
benar brasil pionir guna etanol bahan bakar utama tebu wajib campur hingga etanol e bensin bahkan e beberapa daerah terap nasional sejak lama kurang gantung minyak,positive
wakil presiden direktur pt toyota motor manufacturing indonesia tmmin bob azam nilai wacana perintah kait campur persen etanol e bahan bakar minyak bbm bisa dampak tumbuh ekonomi nasional bob temu karawang jawa barat,positive
campur etanol persen arti bahan bakar punya manfaat lipat buat indonesia rakyat,neutral
impor etanol lebih mati produk gula negeri tetes tebu molase negeri tidak serap tani alami rugi cukup besar mau buat campur e bahan pasti masih import campur etanol lebih murah,positive
lebih banyak serap hasil tani lapang kerja tambah bbm campur etanol siap bantu,positive
etanol sifat higroskopis tarik kelembaban air bisa sebab korosi karat tangki bensin logam baja motor utama model lama tidak rancang campur etanol pertalite resmi pertamina tidak kandung etanol,positive
campur etanol e umum aman bagi besar kendara modern pasca modifikasi as eropa kendara lama mesin kecil kapal bisa risiko korosi pisah fase simpan lama cek manual kendara,positive
etanol tebu amp jagung bantu tani lokal wujud energi bersih indonesia baca lebih lanjut lalu link,positive
esdm dorong campur etanol bensin tingkat oktan amp kurang emisi karbon,negative
