clean_tweet,sentimen
data baru oktober indonesia produksi kalau bioetanol per tahun masih impor kalau perintah baru tuju mandat e campur etanol bensin kurang impor bahan tebu sedang kembang via food,positive
biofuel indonesia campur bbm pakai sawit jadi biosolar b tuju b bensin gerak tuju campur bensin pakai etanol amrik e nama etanol bisa turun jagung as tebu brasil kalau tidak salah lama an dengee jadi,negative
campur etanol bensin turun efisiensi etanol punya energi lebih rendah mj l vs mj l bensin murni e etanol jarak tempuh bisa turun per liter arti lebih boros resiko endap lengket gummy etanol sifat,positive
kendara campur etanol rendah base fuel pertamina umum aman bisa sebab korosi ringan komponen karet logam tidak kompatibel cek manual kendara guna aditif anti korosi konsultasi mekanik,positive
jelas bagaimana campur etanol bensin sebab turun efisiensi bahan bakar arti lebih sedikit kamu tempur per liter resiko bentuk endap lengket gummy bisa sumbat salur injeksi,negative
campur etanol bbm bisa tingkat oktana bikin performa mesin lebih baik amp emisi hc cowok lebih rendah energi sedikit turun bensin murni amp risiko korosi kendara lama non flex fuel cek kompatibilitas kendara konfirmasi resmi bijak,positive
mandiri energi nyata salah satu lewat campur etanol bbm hasil bumi indonesia,positive
spbu swasta bp akr vivo shell batal beli bbm pertamina kandung etanol base fuel impor anggap tidak sesuai spesifikasi pesan mes bbm murni campur datang campur etanol,negative
bangkit potensi daerah campur etanol bbm kurang impor buka peluang baru,negative
bahan bakar campur etanol investasi bumi masa depan ekonomi daerah,neutral
benar banyak negara guna campur etanol bbm brasil e hingga e as e hingga e india thailand e argentina e bantu kurang gantung fosil dukung energi bersih sumber global,positive
pilih bbm campur etanol arti dukung lapang kerja baru mandiri bangsa,positive
campur etanol bbm energi makin mandiri tani tebu bisa kembang pesat,positive
bbm campur etanol wujud nyata energi daulat ekonomi masyarakat,positive
memang lucu banget menteri satu tolak campur etanol malah jadi atur wajib alias tidak masalah kalau campur jadi atur malah campur,positive
tidak campur etanol bbm banyak oplos campur jenis jual harga tinggi campur etanol memang plus efek panjang mesin hancur pelan utama karat tangki bensin etanol mesin tidak mudah karat amp otomatis masih bisa lama pakai,positive
masalah kualitas bbm ramai campur etanol bensin paman dok,neutral
canda coba cari informasi petronas guna etanol bahan campur bbm hasil tidak guna etanol bbm jual massal etanol guna rencana bbm kendara f,neutral
bbm campur etanol bukan buat kendara manfaat luar biasa masyarakat luas,positive
tidak tidak benar bijak bahlil wajib campur etanol tebu bbm kurang impor tuju prabowo bukan sperma soal kualitas bahlil tidak turun malah ramah lingkung sumber cnbc cnn indonesia,positive
belum menteri esdm bahlil lahadalia ungkap presiden restu buat peta jalan guna etanol campur bensin,neutral
kait rencana perintah guna etanol campur bahan bakar minyak bbm jenis bensin banyak e,positive
bbm campur etanol bukti potensi lokal bisa dorong mandiri energi ekonomi,neutral
negara bagi as sendiri larang pakai campur mtbe amp wajib pakai etanol kok pasar indonesia malah pakai campur mtbe sangat racun,positive
jadi bagi ubah ekonomi daerah cukup konsumsi bbm campur etanol,neutral
kurang impor cipta kerja mandiri energi campur etanol bbm,negative
negara negara as brasil india china ue kendara modern umum sejak an rancang kompatibel campur etanol guna e e banyak pakai flex fuel vehicle ffv kadar tinggi indonesia perintah nyata,positive
campur etanol hingga bbm aman penuh standar jamin bahlil umum banyak negara bisa turun efisiensi bahan bakar sedikit risiko korosi mesin lama cek spesifikasi kendara pasti,positive
menteri esdm bahlil lahadalia tegas etanol layak guna campur bbm,positive
bbm campur etanol e umum aman mesin kendara modern keluar atas tingkat oktan kurang emisi bisa turun efisiensi bahan bakar risiko korosi mobil lama mesin kecil pasti kendara,positive
campur etanol bbm bisa sebab korosi sistem bahan bakar utama pipa injektor seal karet tidak kompatibel etanol sifat higroskopis korosif etanol serap air udara risiko pisah fase sumbat karburator rusak,positive
apa betul bbm campur etanol aman buat mesin,positive
bbm swasta wajib pakai campur etanol naik oktan lebih ramah lingkung produk as biasa pakai campur mtbe sangat racun cari air amp lingkung,positive
campur etanol e bbm tuju prabowo kurang impor emisi segi kualitas energi sedikit lebih rendah kurang jarak tempuh oktan lebih tinggi bisa tingkat performa mesin modern aman mobil keluar bisa,positive
bijak wajib campur etanol e bbm tepat strategis kurang gantung impor fosil emisi karbon mirip sukses as australia terap ganggu kualitas mesin infrastruktur siap lebih banyak dorong,positive
nyata bahlil benar banyak negara guna campur etanol bbm contoh brasil hingga as e e india thailand china bantu kurang emisi impor minyak kurang potensi korosi mesin konsumsi energi,positive
bodoh malah anti etanol padahal etanol campur paling aman buat fermentasi tebu justru shell pakai campur mtbe sangat racun cari air jadi masalah kualitas logam kendara sekarang sangat busuk kendara tahun an mah aman bos,positive
bodoh kamu justru shell pakai campur mtbe sangat bahaya buat lingkung sangat racun cari air paling aman lingkung jelas pakai etanol etanol buat fermentasi tebu jadi masalah mesin baru kualitas logam a busuk jadi mudah korosif mesin tahun an aman,negative
campur etanol sama misal e kualitas bbm indonesia banding negara as brasil oktana naik emisi turun hingga energi sedikit rendah kurang efisien aman mesin modern meski standar sulfur mungkin lebih tinggi republik indonesia debat lebih,positive
lalu bagaimana kualitas bbm indonesia banding negara kalau andai campur sama etanol,negative
pakar itb campur etanol persen e aman guna mobil motor injeksi produksi atas,positive
etanol campur biofuel campur bahan bakar fosil kurang pakai bahan bakar fosil kalau misal etanol arti bahan bakar fosil energi baru baru fitra eri,positive
menteri energi sumber daya mineral esdm bahlil lahadalia kata campur etanol kandung bahan bakar minyak bbm lazim bagai negara contoh brasil mampu campur etanol bbm kadar persen bahlil campur,positive
campur etanol kendara mogok semua lalu minta henti campur etanol pilih import import bajing nikmat komisi makanya tidak mau bangun kilang pilih import terus,positive
beberapa negara pakai etanol bbm brasil sukses besar campur hingga tebu kurang impor minyak emisi as e umum dorong tahan energi tantang harga jagung india target e capai khawatir aman,positive
banyak negara bukti efisiensi baik etanol campur bbm,positive
etanol impor campur bbm peluang banjir negeri bahlil kena sentil,neutral
lol apa hubung disel etanol tidak sambung etanol alkohol campur bbm jenis bensin diesel bbmnya jenis solar sambung biosolar cpo hancur mesin diesel kamu campur etanol,positive
campur etanol e pertalite ron pertamax ron bisa tingkat oktan kurang emisi cowok dukung biofuel lokal energi lebih rendah bikin efisiensi bbm turun konsumsi naik mesin modern aman kendara lama risiko korosi,positive
campur etanol e bensin tuju kurang emisi dukung biofuel tebu jagung mesin modern rancang tahan efisiensi bbm bisa turun etanol energi lebih rendah per volume kendara lama risiko korosi bahan bakar pisah fase,positive
fakta jakarta bukan jadi kota polusi dunia karbon hasil buang kendara motor hasil campur etanol bbm keras kepala soal cempuran etanol kendara negara tidak pakai etanol bbm sirkuit balap jangan jalan umum indonesia,positive
konsultasi siapa kata etanol aman pakai campur bahan bakar benar kalau kerja tidak rugi susah rakyat,positive
abang tambah e kata restu presiden prabowo,neutral
pusing aman campur etanol campur etanol aman wkkk,positive
tren guna etanol campur bahan bakar minyak bbm kini jadi arus utama bagai negara langkah anggap strategi global tekan emisi karbon sektor transportasi sekaligus kurang gantung bahan bakar fosil,neutral
kalang menteri teknis esdm baik profesional murni bukan partai politik tanya pakar energi arcandra tahar wajib tulis beli bbm refinery pasti campur etanol etanol oktannya memamg,positive
benar banyak negara brasil e hingga e as india e thailand e e lain guna campur etanol bbm kurang emisi data wikipedia statista sumber konfirmasi,positive
pakar ugm dukung campur etanol persen bbm,neutral
info gambar valid dasar nyata menteri esdm bahlil lahadalia prabowo tuju mandatori campur etanol e bbm bensin kurang impor emisi terap langsung susun roadmap mungkin tahun depan sumber cnbc,positive
pakar ugm dukung campur etanol persen bbm,neutral
lama pakai campur etanol mobil pribadi istirahat pindah angkut umum,negative
campur etanol bbm e tuju kurang emisi tingkat mandiri energi akibat positif tingkat oktan potensi tambah tenaga mesin ramah lingkung negatif kandung energi lebih rendah mungkin turun efisiensi resiko korosi,positive
perintah indonesia rencana laku mandatori e indonesia campur etanol bbm bijak tuju kurang impor tuai kontra campur etanol nilai pengaruh turun kualitas bbm,positive
guna etanol campur bahan bakar indonesia terus jadi bincang meski banyak negara maju lumrah terap tanah air masih sisa pro kontra benar campur etanol bbm tidak buruk stamina mesin,positive
resmi perintah tuju mandatori campur etanol persen e bbm dorong energi bersih kurang impor,positive
polemik soal rencana tingkat jumlah campur etanol bbm jenis bensin hingga e terus lanjut tahu wajib guna etanol tuju kurang impor hadir bahan bakar ramah lingkung praktik umum banyak negara,positive
tanya kenapa pakai campur etanol meski apa,neutral
menteri esdm bahlil lahadalia tegas campur etanol bbm rupa langkah umum bagai negara dukung energi bersih sebut brasil bahkan capai campur etanol e beberapa wilayah brasil negara as,positive
tidak selalu benar campur etanol e aman banyak kendara modern bisa timbul masalah lebih tua tidak kompatibel korosi selang tangki komponen karet ahli energi lebih rendah bisa bikin boros bbm,positive
benar campur etanol persen bbm rusak mesin,neutral
tema mou bahan murni kasih campur etanol prosentase punya titip untung siapa,positive
bahlil soal bbm campur etanol negara pakai baca,neutral
campur etanol bbm bisa pengaruh kualitas gantung perspektif etanol tingkat oktana amp kurang emisi turun kandung energi bikin lebih boros campur rendah tidak selalu buruk bisa korosi mesin tidak kompatibel sumber studi,negative
wahai benar campur etanol bbm bisa tidak turun kualitas bbm jawab jujur jangan ikut jadi termul,positive
tahun uk naik batas atas kadar etanol boleh e jadi e kurang emisi cowok uk negara eropa lain batas atas kalau indonesia diksi mandatori campur apa maksud tepat,negative
negara cukup lama sih etanol campur gasoline us jual e campur ethanol,negative
kendara modern kendara rancang modern biasa tahun atas umum lengkap komponen tahan etanol aman guna bahan bakar campur etanol hingga e,positive
batal rencana program campur etanol sebut sepakat beli kuota tambah lalu pertamina buah cukup bagus basefuel impor pertamina memang masih murni kandung etanol,positive
jakarta menteri energi sumber daya mineral esdm bahlil lahadalia aku presiden prabowo subianto beri lampu hijau wajib campur etanol besar liter bensin bahan bakar minyak bbm baca lengkap,positive
wakil presiden direktur pt toyota motor manufacturing indonesia tmmin bob azam tanggap rencana perintah wajib campur etanol bbm turut sebut lumrah laku luar negeri,neutral
campur etanol e bensin bisa tingkat oktane performa mesin kurang emisi energi lebih rendah konsumsi bbm naik jarak tempuh kurang mesin lama bisa sebab korosi seal karet selang komponen plastik mesin,negative
negara mana bbm dapat campur etanol berapa kadar etanol,neutral
campur etanol persen nilai masih aman kendara modern,positive
memang masih percaya,neutral
campur etanol tidak impor banyak bagaimana tidak impor bisa rusak mesin brok ah pusing banget jadi wni,negative
lucu begini tutup langka swasta beli kata pertamin yaudah dong swasta bilang yaudah beli kamu mau pure cek nyata campur etanol terus sekarang sih bahlil keluar statement kalau bensin,positive
menteri energi sumber daya mineral esdm bahlil lahadalia sampai presiden prabowo subianto tuju terap bijak mandatori campur etanol besar persen bahan bakar minyak bbm baca lengkap,positive
pertamax campur etanol pipis bahlil,neutral
dasar telusur nyata bahlil soal bbm campur etanol e aman tidak turun performa mesin dukung beberapa studi sebut campur etanol bisa tingkat efisiensi kurang emisi mesin modern sumber jakartaglobe forum,positive
perintah mau wajib campur etanol persen bbm perintah bakal terap mandatori alias wajib campur etanol persen e bahan bakar minyak bbm,neutral
campur etanol e bbm bisa dampak kendara dampak positif kurang emisi ayo buang lebih ramah lingkung dampak negatif turun efisiensi bahan bakar konsumsi bbm naik potensi korosi kendara tua mesin kecil resiko,positive
negara sibuk kembang teknologi robot ekspedisi ruang angkasa negara sibuk urus ijazah palsu sama campur etanol bbm,negative
gamau pertamina saing sama swasta swasta berat ada campur etanol produk perintah hadir usul wajib campur etanol kata ada campur etanol harap tidak impor banyak ramah lingkung,negative
wakil presiden direktur pt toyota motor manufacturing indonesia tmmin bob azam tanggap rencana perintah wajib campur etanol bbm turut sebut lumrah laku luar negeri,neutral
pertamax tuh campur etanol air pipis bahlil,neutral
transisi energi bersih mulai change sederhana pilih campur bbm etanol isi bensin,positive
campur bbm etanol bioetanol sering sebut e e e e persen etanol benar punya banyak manfaat baik buat lingkung mesin ekonomi energi nasional jelas ramah lingkung emisi lebih bersih etanol asal,positive
menteri energi sumber daya mineral bahlil lahadalia menep anggap etanol tidak layak campur bahan bakar minyak baca sini ta,neutral
muka hujan campur air berapa amp berapa etanol,positive
pakar otomotif institut teknologi bandung itb yannes martinus pasaribu kata implementasi kait campur etanol persen e bahan bakar minyak bbm masih aman guna kendara modern,positive
nah tanya arti tidak rekomendasi pakai pertalite oktan berapa besar campur etanol petamax turbo,negative
pakar otomotif itb yannes martinus pasaribu kata implementasi kait campur etanol persen,neutral
tetes campur bbm etanol jadi sumbang buat udara lebih bersih,neutral
apa campur etanol kampanye ev,neutral
prabowo tuju tiap liter bbm campur etanol e,neutral
kalau lihat bahasa asli buku manual bahasa inggris benar toyota tidak boleh pakai campur etanol batas toleransi maksimal ngeri perintah langsung pukul rata ambil jadi margin of errornya tahu sendiri kualitas blending pertamina kayak apa,positive
berita seperti meme edit berita asli campur etanol bbm pertamina umum menteri esdm bahlil lahadalia kalau benar benar sperma bakal absurd resiko kontaminasi biologis masalah sehat tolak etis amp ilmiah,positive
campur etanol mau ditambahin qris,neutral
campur memang bisa up ron energi turun lebih boros bbm amp biaya etanol lebih mahal ini sebut efisiensi cara kerja buruk sehrsnya upgrade kilang bisa hasil langsung ron campur etanol,negative
resiko etanol mesin kendara campur bbm e konsumsi bbm lebih boros energi rendah turun korosi tangki selang komponen mesin utama kendara lama serap air sebab pisah fase sumbat sulit,positive
menteri energi sumber daya mineral esdm ungkap arah presiden prabowo subianto bijak mandatory campur etanol bbm jenis bensin e menteri esdm bahlil lahadalia ungkap rencana laku turun dampak emisi karbon,positive
akademisi itb itera soal etanol aman jadi bahan campur bbm,positive
budaya campur mencapur istimewa biasa campur etanol campur tangan legi campur tangan pam sisa campur tangan ordal kapan bisa rakyat rasa nikmat bbm murah,positive
lama siksa masyarakat cos baik motor mobil dampak campur etanol mending kamu henti sekali produksi motor mobil kamu usir semua usaha kamu pengin mundur teknologi kan pengem zaman batu kan bijak aneh,positive
campur etanol bensin e e umum aman mesin mobil jepang modern toyota amp suzuki rancang kompatibel studi nrel dampak positif bakar lebih bersih emisi cowok hc lebih rendah negatif kurang efisiensi bbm resiko korosi amp,positive
campur etanol buat banyak kendara rusak apa perintah mau ganti rugi kendara rusak kateba bbm campur etanol,positive
campur etanol bensin e bisa buat bakar lebih bersih ilmiah etanol kandung oksigen bantu oksidasi lebih lengkap kurang emisi cowok hidrokarbon tidak bakar bisa tingkat emisi nox acetaldehyde,positive
campur etanol bbm umum aman kendara modern masuk indonesia banyak mesin rancang bisa bahaya kendara lama mesin kecil korosi serap air degradasi komponen karet plastik efek samping turun,positive
tidak semua mesin pabrikan kendara bisa terima campur etanol bisa jadi tangki spbu swasta pertamina siap duh perintah khusus kemen esdm tidak punya humas bicara jelas masalah usaha kelas pertamina tidak punya parah,positive
gantung konsentrasi campur etanol umum kok,positive
campur etanol bbm bisa tingkat kualitas naik oktana kurang emisi cowok dukung lingkung bisa turun efisiensi bahan bakar risiko korosi lebih menteri esdm rekomendasi campur e wajib,positive
serah pertamina mau pakai etanol berapa persen masyarakat hak dapat produk baik sesuai ingin memang kalau swasta tidak pakai campur etanol pertalite bakal tidak laris sama mau pakai etanol tidak pertamina tetap rugi,positive
inti kenapa campur etanol mungkin cara management buruk tambah korupsi bukan jangka panjang negara bbm murah campur etanol etanol murah analisa potensi jadi korupsi,positive
bbm campur etanol mayarakat rela antri menit sendiri bbm murni padahal campur etanol kurang tepat negara punya kelembapam udara tinggi tidak semua jenis kendara terima campur etanol bbm negara apa,positive
campur etanol e bbm bisa kurang emisi karbon gantung impor minyak pakai bahan lokal tebu singkong energi etanol lebih rendah konsumsi bbm sedikit boros risiko korosi mesin lama tidak kompatibel pastiin,positive
kontaminasi air campur bensin etanol dapat pisah diri phase separation mana etanol air endap dasar tangki dapat sebab masalah mesin mesin sulit hidup potensi korosi kandung energi lebih rendah,negative
untung ekonomis subsidi kira kira bodoh indak konsumen bayar misal misal misal ojo nesu pengaruh harga jual berapa liter bbm campur etanol grok,negative
spbu swasta batal beli bbm pertamina alas perintah bakal wajib campur etanol,neutral
pangkas emisi karbon indonesia bakal wajib campur etanol bbm,neutral
berapa jenis kendara sekarang edar plus enam tanya bisa tahan bbm campur etanol lebih kendara roda,positive
ktahuan oplos campur etanol tinggi sekali buat atur kali kocak bin bodoh,negative
kait bbm etanol turun impor campur ganti bensin etanol lokal tebu sawit kurang butuh impor meski produksi migas rendah sesuai bijak perintah mandiri energi utama kurang volume bensin murni dampak,negative
perintah tahu campur bensin etanol bikin karat boros kendara biasa buat atur mewjibkan etanol campur bbm laku jadi normal tidak campur arti tidak wajar cara cara jokowi duplikasi baik bahlil,positive
perintah wajib campur etanol bbm mana paling penting buat pilih bbm streaming,positive
kata sawit buat campur bbm kok malah etanol,neutral
lama bbm pertamina pertalite tidak kandung etanol konfirmasi pertamina bukan hoax pertamax green punya etanol varian pertamax turbo punya campur rendah tingkat oktan amp kurang emisi komposisi dasar,negative
pertamina pertalite tidak kandung etanol lapor kontroversi kandung etanol bahan baku bbm spbu swasta perintah rencana wajib campur etanol tahun depan,negative
benar perintah indonesia baru tuju bijak campur etanol e bbm kurang emisi cowok impor bahan bakar dukung industri lokal tuju kurang dampak lingkung gantung impor dampak mesin aman banyak,positive
perfoma mesin rusak mesin jadi kendara lama kompatibel bbm etanol kendara banyak pakai sini pabrikan jepang kompatibel produksi tahun etanol e pertamax green milik campur etanol,negative
campur etanol base fuel bbm impor pertamina tingkat ron murah etanol punya energi lebih rendah mj tidak vs mj tidak bensin potensi bikin mesin lebih boros bahan bakar bijak kritik harga beli etanol,positive
info begini penting banget sih meski orang tidak salah paham soal campur etanol,positive
bahlil campur persen etanol,neutral
negara negara amerika serikat india thailand bahkan terap campur bahan bakar basis bioetanol hingga e kandung persen etanol,neutral
sisi industri otomotif bahan bakar campur etanol rendah tetap aman guna jalan tren energi bersih dunia,positive
base fuel pertamina memang kandung etanol persen sepenuh sesuai regulasi perintah boleh campur hingga persen etanol,negative
pimpin toyota soal etanol bbm kendara tidak masalah fakta campur etanol bbm sebut praktik umum seluruh dunia tekan emisi karbon dukung transisi energi hijau,negative
campur etanol e umum aman kendara modern mobil keluar an masuk avanza xpander sesuai pandu pabrikan toyota bisa timbul masalah kendara lawas motor kecil korosi seal,positive
fakta campur etanol bbm praktik umum seluruh dunia tekan emisi karbon dukung transisi energi hijau,negative
lama bagi guna kendara memang sempat rasa khawatir guna bbm campur etanol bisa dampak performa mesin utama kendara keluar lama klarifikasi pihak toyota anggap sangat yakin menep ragu sebut,positive
pimpin toyota soal etanol bbm kendara tidak masalah fakta campur etanol bbm praktik umum seluruh dunia tekan emisi karbon dukung transisi energi hijau,negative
pimpin toyota santai soal campur etanol bbm kata mobil mobil sekarang siap kok tidak masalah arti lama bahan bakar sesuai standar performa tetap aman malah bisa bantu kurang emisi,positive
ada campur etanol untung konsumen kendara bisa lebih irit konsumsi kamu bisa lari cepat kamu jam,positive
pimpin toyota soal etanol bbm kendara tidak masalah fakta campur etanol bbm praktik umum seluruh dunia tekan emisi karbon dukung transisi energi hijau,negative
pimpin toyota santai soal campur etanol bbm kata mobil mobil sekarang siap kok tidak masalah arti lama bahan bakar sesuai standar performa tetap aman malah bisa bantu kurang emisi,positive
padahal etanol mah campur jang bibit parfume parfume,neutral
berita benar lapor reuters presiden prabowo tuju bijak campur etanol bbm usul menteri bahlil kurang impor sumber oktober,positive
menteri energi sumber daya mineral esdm bahlil lahadalia umum rencana perintah terap bijak mandatori campur etanol persen e bahan bakar minyak bbm,positive
nyata banyak negara pakai campur etanol loh,positive
benar tuju kurang impor akal akal konsumsi bbm tingkat bensin campur etanol lebih boros beberapa banding bensin murni akal akal pom swasta mau tidak mau beli bensin pertamina campur etanol,positive
jadi makin yakin isi bbm campur etanol,positive
benar campur etanol tidak sepenuh jelek memang lebih ramah lingkung perlu perhati kendara negeri kompatibel bensin campur etanol rasa sih tidak banyak jadi ngempot,positive
campur bensin etanol e umum guna resiko korosi sistem bahan bakar utama mesin lama kecil motor rumput pisah fase kontaminasi air bisa bikin mesin mogok knocking turun efisiensi bahan bakar,positive
etanol campur bahan bakar bensin punya efek positif negatif positif kurang emisi cowok hidrokarbon bakar lebih sempurna ramah lingkung baru negatif turun efisiensi bahan bakar boros bisa korosi mesin tidak,positive
pisah bensin etanol campur air video tambah air campur bensin etanol rasio air bensin kocok kuat lalu diam hingga pisah jadi lapis atas bensin bawah etanol air tuang lapis atas bensin,positive
wah kalau sih arti bikin orang indonesia meski beli mobil baru mesin aman buat bensin campur etanol,positive
bbm murni plus etanol masih aman kok cuma mobil modern bisa terima campur jadi mesti tidak masalah buat konsumen,positive
beberapa negara guna e etanol bbm liput as standar nasional australia umum queensland amp nsw thailand wajib china pilot beberapa kota brasil campur lebih tinggi e eropa austria belgia bulgaria,positive
menteri esdm bahlil lahadalia ungkap garap rencana wajib campur etanol bbm guru besar itb nilai langkah tidak perlu laku lantar regulasi atur spesifikasi bahan bakar minyak bbm boleh jual indonesia cukup,neutral
beberapa negara maju terap atur campur etanol bbm contoh as mandat etanol e bisa hingga renewable fuel standard uni eropa banyak negara anggota wajib hingga biofuel masuk etanol target tingkat hingga kanada,positive
omong omong atur campur etanol besar tahun target jadi etanol pantas orang bilang isi swasta sama prtamina rasa beda nyata memang beda,positive
jumlah negara dunia makin agresif dorong guna etanol campur bahan bakar minyak bbm tekan emisi karbon sektor transportasi,neutral
tren rupa lihat eropa asia perintah industri energi lomba luas guna bioetanol bagi komitmen global kurang emisi masuk indonesia baru guna etanol kandung bbm,positive
indonesia mampu ekspor etanol produksi batas ribu kalau tahun bahkan impor kecil butuh domestik campur bbm e gula memang masih impor prakira juta ton produksi domestik juta ton vs,positive
etanol senyawa kimia organik rumus sih h kenal alkohol etil rupa cair tidak warna mudah bakar sering guna bahan bakar campur bbm kurang emisi larut minum alkohol,negative
